,Place,Person,Post,Share,Date
641,,['HashCorner'],"แกร๊ จากที่ได้ไปฮอกไกโดมาทั้งหมด 11 วัน เราได้นอนทั้งหมด 7 โรงแรมใน 5 เมือง (Sapporo, Hakodate, Asahikawa, Abashiri, Kushiro) ทั่วเกาะฮอกไกโด ทีนี้ก็เลยจัดมาเป็นรีวิวทุกที่ที่ได้ไป เช่น โลเคชั่น ห้องนอน… เพิ่มเติม",,2017-04-04 15:36:00
642,,['HashCorner'],"สงกรานต์ไปไหนกันน? นี่ไม่ได้ไปไหนเลยว่ะะะะะ ถถถถ
เดี๋ยวช่วง 2 อาทิตย์นี้ รีวิวจะปล่อยรัวมากหลังจากปล่อยมันค้างเติ่งมานาน ทั้งฮอกไกโด / Foto Hotel Phuket / Saturdays Phuket / หมู่เกาะสุรินทร์ / หมู่เกาะสิมิลัน โอ้ยย เยอะ TT",,2017-04-03 14:37:00
643,,['HashCorner'],"พุกาม (Bagan) #พม่าคนเดียว
ส่วนมากคือจะเห็นแต่รูปพุกามพระอาทิตย์ขึ้นมาบอลลูนใช่ป่ะ เอางี้ นี่จะพาไปดูพุกามในภาพถ่ายอื่นๆบ้าง มาดูว่ามันมีสเหน่ห์น่าค้นหาขนาดไหน… เพิ่มเติม",,2017-04-02 17:29:00
644,,"['HashCorner', 'เทศบาลนครภูเก็ต']","ให้ชีวิตมันเป็นสีชมพู 💞
ใครที่ยังไม่มีแฟนก็ขอให้ได้ ขอให้โดน
ปล. นี่จำไม่ได้จริงๆว่าตรงนี้เค้าเรียกว่าอะไรในเมืองภูเก็ต ที่เป็นตึกสีสันเยอะๆ 55555",,2017-04-02 13:20:00
645,,['HashCorner'],"กราบ กระทู้รีวิวบาหลีอันนี้ รูปสวยเลอค่า
นี่ว่าจะหาเวลาไปบาหลีอีกซักรอบแล้วต่อ Lombok งี้ ดีมั้ย ดีมั้ย",,2017-03-31 17:43:00
646,,['HashCorner'],"วันนี้จะมารีวิว OPEN HOUSE ที่เพิ่งเปิดใหม่สดๆ ร้อนๆ ที่ Central Embassy กันนาจา.. (รีวิวนี้เขียนมาจากฟีลลิ่งที่ได้ไปมาจริงๆ โนสปอน)
Open House ที่นี่ จะบอกว่าเป็น Co-working Space ก็ไม่ใช่ ร้านอาหารก็ไม่เชิง… เพิ่มเติม",,2017-03-30 11:29:00
647,,['HashCorner'],"3 แอพแต่งรูปที่ต้องมีในมือถือออออ
เอาจริง คำถามที่ว่าใช้แอพไรแต่งรูป โดนถามเยอะมากกกก .. เท่ากับคำถามที่ว่าใช้กล้องไรถ่ายรูป กับไปเที่ยวคนเดียวถ่ายรูปตัวเองยังไง วันนี้เลยจะมาบอกว่า เราใช้แค่ 3… เพิ่มเติม",,2017-03-27 21:09:00
648,,['HashCorner'],"ขอบคุณ ทีมพีอาร์การรถไฟแห่งประเทศไทย ครับผม 🙏🏻
ใครยังไม่ได้ไปใช้บริการรถไฟขบวนใหม่ บอกเลยว่าดี๊ดีย์ รีวิวรถไฟขบวนใหม่ > https://goo.gl/PV0W4n",,2017-03-27 15:21:00
649,,['HashCorner'],เมื่อเที่ยงแชร์ลิงค์รีวิวไปแล้ว ถ้าขี้เกียจอ่านลองดูรูปก่อนก็ได้ว่าโบรโม่-คาวาอีเจี้ยน มันดีย์ขนาดไหน ดูรูปให้จุใจพอให้ความอยากเริ่มมี จากนั้นชวนเพื่อน แล้วค่อยจองตั๋วเครื่องบิน… เพิ่มเติม,"ต้องบอกว่า สถานที่ฮิตสำหรับคนไทย ณ ตอนนี้ หนึ่งในนั้นต้องเป็น โบรโม่ คาวาอีเจียน ประเทศอินโดนีเซีย
อาจเป็นเพราะประเทศไทยของเราไม่มีภูเขาไฟหรือเปล่า หรือเพราะความอลังการงานสร้างของโบรโม่และคาวาอีเจียน… เพิ่มเติม",2017-03-25 21:21:00
650,,['HashCorner'],"จำได้ว่าปีที่แล้ว ภูเขาไฟโบรโม่โคตรฮิต แต่มันก็พีคจริง ถ้าอยากไป..รีบไปเลย บอกเลยว่าโคตรคุ้มค่า
สำหรับเส้นทางที่แนะนำคือ กทม-สุระบายา-โบรโม่-คาวาอีเจี้ยน-บาหลี-กทม เป็นทริปยาวติดกันได้ มันดีย์มากกก แต่ถ้ายังมีเวลาเหลือ เพิ่มบุโรพุทโธด้วยก็ได้ นี่ไปแล้วว ☺️
https://goo.gl/1DoS93",,2017-03-25 12:00:00
651,,['HashCorner'],ปีใหม่ก็แล้ว วาเลนไทน์ก็แล้ว นี่จะสงกรานต์แล้วนะ สรุปหาแฟนกันได้ยัง? 55555555,"แหมมม เห็นหลายคนโสดแล้วขี้บ่นอยากมีแฟนงู้นงี้ นี่เลยจัดมาให้ว่า ""เที่ยวยังไงให้ได้แฟน"" ตามภาษาคน #โสดต้องเที่ยว จัดไปค่ะ!",2017-03-23 19:05:00
652,,"['HashCorner', 'Blu Monkey Hotels']","เราว่าผิวสีแทนแม่มโคตรคูลลล
แต่ตอนนี้มันแทนเป็นทูโทนอะ 555555555
#fotohotel",,2017-03-23 12:20:00
653,,"['HashCorner', 'Surin Islands']",ปกติเราไม่ใช่สายดำน้ำ สายทะเล เพราะสิ่งหนึ่งที่ทำให้เราไม่ค่อยอินกับทะเลเพราะเรากลัว.. กลัวเว้ย กลัวจริงๆ เรากลัวใต้น้ำ เรากลัวอะไรที่มันมองไม่เห็น เรากลัวว่าอยู่ดีๆ… เพิ่มเติม,,2017-03-22 13:48:00
654,,['HashCorner'],คงไม่มีใครไม่รู้จักเกาะช้างแน่ๆ แหมม เกาะนี้คือเกาะที่ใหญ่ที่สุดในอ่าวไทยและใหญ่อันดับสองของประเทศรองจากเกาะภูเก็ตเลยทีเดียวนะ ครั้งนี้มีโอกาสได้ไปเที่ยวและพักผ่อนหย่อนกายที่เหนื่อยล้าจากกรุงเทพ… เพิ่มเติม,,2017-03-21 20:34:00
655,,"['HashCorner', 'Chalong, Mueang Phuket']","มาภูเก็ตแล้วต้องไปที่ไหนบ้าง ขอคนละสถานที่หน่อยครับ ฮี่ฮี่ พร้อมแบกเป้แล้ว ☺️
Anti-theft Backpack Bobby Bag #bobbybagth",,2017-03-21 14:02:00
656,,"['HashCorner', 'Similan Islands']",ซัมเมอร์นี้ไม่ต้องไปต่างประเทศที่ไหน เมืองไทยนี่แหละมึง เด็ดสุดในโลกนี้แล้ว หาดทรายขาวๆ ต้นไม้เขียวสไตล์ทรอปิคอล กับน้ำใสๆของทะเลอันดามันไทย โอ้โหว ตายไปเลยแจ้~ #wowandaman,,2017-03-19 20:56:00
657,,['HashCorner'],"ถ้าใครมาฮอกไกโด คือไม่มาซัปโปโรไม่ด๊ายยยย~ แกร มันคือเมืองหลวงของเกาะฮอกไกโดไงคะ ที่นี่มีทุกสิ่งอย่าง กิน เที่ยว ช็อปปิ้ง เที่ยวกลางคืน ไม่เป็นรองโตเกียว
เราจะไปกินซุปแกงกะหรี่ที่ซูซูกิโนะ… เพิ่มเติม",,2017-03-18 19:15:00
658,,['HashCorner'],"ขอบคุณ Dailynews นะคร้าบบบ
'6 หนุ่มมือรีวิว เสน่ห์เที่ยวคนเดียวดีต่อใจ' ฮิ้ววว 😂",,2017-03-18 17:43:00
659,,"['HashCorner', 'Similian Islands']","อากาศร้อนๆแบบนี้ แม่งต้องไปทะเลดิ เตรียมตัวเจอกันกับ HashCorner Summer Collection ซัมเมอร์ประชดความร้อนประเทศไทย 55555555 🤘🏻
#wowandaman #quiksilverthailand #roxythailand #bucketlistthailand #monkeydivehostel",,2017-03-17 21:34:00
660,,['HashCorner'],"「HOKKAIDO WINTER EDITION」HashCorner จะพาเที่ยวฮอกไกโด 9 เมือง ภายใน 2 นาที ด้วยคลิปวิดีโอตัวนี้
ทริปฮอกไกโดทริปนี้แม่งโหดสึส 11 วัน กับอากาศอุณหภูมิติดลบตั้งแต่ -5 ยัน -15… เพิ่มเติม",,2017-03-17 17:00:00
661,,['HashCorner'],"「COLOR SHADES OF HOKKAIDO」
Sapporo / Otaru / Biei / Asahikawa / Abashiri / Kushiro / Hakodate
เตรียมพบกับรีวิวฮอกไกโดหน้าหนาว (หนาวสึสๆ) ได้เลยกับ 7 เมืองทั่วเกาะฮอกไกโด ที่ HashCorner เริ่มต้นอาทิตย์นี้ ได้โปรดจงติดดาวเพจนี้ไว้ได้เลย
#Hashcorner #Hokkaido #ExpediaTH",,2017-03-16 16:03:00
662,,"['HashCorner', 'โอะตะรุ']","อัพรูปมีหิมะ เผื่อจะคลายร้อนได้บ้าง คือเมืองไทยจะร้อนอะไรขนาดนั้นอ่ะ 😩 #ร้อนสัสซัปโปโร
ปล. (1) รีวิวแรกซัปโปรมาอาทิตย์นี้แจ้
ปล. (2) รูปนี้แม่งโป๊ะ ดูออกเลยว่ากดชัตเตอร์เองจากมือถือถ่ายรูปตัวเองอยู่ 55555555
ปล. (3) พรุ่งนี้ไปภูเก็ตแจ้ ฮิ้ววว",,2017-03-15 19:39:00
663,,['HashCorner'],บาหลีช่วงนี้แม่มฮิตอะไรขนาดนั้น เราก็แชร์วนไปดิ ใครยังสนใจอยากลองไปเที่ยวบาหลีแบบคูลๆ ตอนเช้าเข้าวัด ตอนสายสำรวจหาดลับ ตอนเย็นเล่นเซิร์ฟ เอ้า..ตามรีวิวไปเล้ยยย :D,,2017-03-14 17:00:00
664,,['HashCorner'],"รู้มั้ยว่าปากเซ ลาว นั้นไปเที่ยวโคตรง่าย แค่บินไปอุบลแล้วนั่ง บขส จากไทยไปปากเซ แค่นี้ก็ได้เที่ยวแล้ว 2 วัน 1 คือ 1,800 บาทขาดตัวไม่รวมเครื่องลงอุบล อยู่แบบสบาย สบายยย ใครอินน้ำตกควรไปปากเซอย่างยิ่ง… เพิ่มเติม",,2017-03-13 19:40:00
665,,['HashCorner'],ถ้ามีฟีลอยากไปเที่ยวแต่ขี้เกียจไปไกลๆ ลองไปนครนายกดิ ขับรถไปชั่วโมงเดียวเองนะเฟร้ย~ ไปกลับวันเดียว หนึ่งพันบาทยังไม่หมดเลยมึ้งงง 5555 https://goo.gl/yQn0OD,,2017-03-06 13:16:00
666,,['HashCorner'],"จะซัมเมอร์ล้าววว หาเสื้อแนว Tropical ลายใบไม้ลายดอกมาใส่ไปเที่ยวทะเลดีกว่า ถ่ายรูปแบบกลมกลืนกับธรรมชาติ ต้นไม้ใบหญ้าแล้วอย่างคูล
ว่าแต่ มีใครแนะนำแหล่งซื้อหรือแบรนด์ไหนมั้งมั้ยครับ 🌴",,2017-03-04 11:16:00
667,,['HashCorner'],"มีโปรโมชั่นพิเศษสำหรับคนชอบท่องเที่ยวแบบเราๆจาก King Power บอกเลยว่าคุ้มที่สุดในรอบปี! ได้ของที่อยากได้ รวมทั้งได้บินไปเที่ยวแบบฟรีๆอีก เป็นยังไงมาดูเลย บอกเลยว่าใครกำลังคิดจะซื้อกล้อง mirrorless, iPhone หรือ… เพิ่มเติม",,2017-03-03 19:00:00
668,,['HashCorner'],"รีวิวพุกาม ลุยเดี่ยว #พม่าคนเดียว 🤘🏻
ใครมาเที่ยวพม่าแล้วไม่ได้มาพุกามที่ถือว่าพลาด ไฮไลท์เด็ดการมาเที่ยวพุกามคือการแหกขี้ตาตื่นมาดูทะเลเจดีย์อาบแสงอาทิตย์ที่โด่งดังไปทั่วโลก พร้อมลุยเที่ยวเจดีย์อื่นๆมากกว่า… เพิ่มเติม",,2017-03-02 15:49:00
669,,"['HashCorner', 'The Dewa Koh Chang']",ตอนนี้โผล่มาเกาะช้างที่ THE DEWA KOH CHANG แล้วววว มีความอลังการแบบ Rustic Tropical กับแกรนด์วิลล่า 2 ชั้น และมีอ่างจากุซซี่ส่วนตัวแบบเอาท์ดอร์ 🐘,,2017-03-01 17:49:00
670,,"['HashCorner', 'ฮะโกะดะเตะ']","วันนี้กลับกรุงเทพแล้วนะเฟ้ย รอชมรีวิวฮอกไกโด 「Hokkaido Winter Edition」ได้เลยยยย จะรีบเขียนแน่นวลลลลลล เอาแบบตามรอยได้ พร้อมรีวิวที่พักทุกเมืองที่ไป Sapporo / Asahikawa / Biei / Abashiri / Kushiro และ Hakodate
ขอบคุณ Expedia กับที่พักราคาดีและ Tripizee สำหรับพ็อคเก็ตไวไฟเร็วปรี๊ดด้วยน้อววววว 🤘🏻
:))
#ExpediaTH #Tripizee",,2017-02-24 10:52:00
671,,"['HashCorner', 'Okurayama Ski Jump, Sapporo']",ได้ใช้ Pocket Wifi ของ Tripizee ในทริปฮอกไกโด ต้องบอกว่าเริ่ดมากกกก นี่เที่ยวเกาะฮอกไกโดเกือบรอบเกาะ สัญญาณของ Tripizee คือดีมากอ่ะ จะไม่มีสัญญาณแค่ตอนนั่งรถไฟลอดอุโมงใต้ภูเขาแค่นั้น แบตอึด… เพิ่มเติม,,2017-02-23 15:26:00
672,,['HashCorner'],"อีกสองวันกลับไทยล้าวววว งืออ ʕ⁎̯͡⁎ʔ༄
#Hokkaido #ExpediaTH",,2017-02-22 18:53:00
673,,"['HashCorner', 'JRイン旭川\u3000Jr INN Asahikawa']","เซฟเก็บไว้เลยสำหรับคนจะมาเที่ยว อาซาฮิกาวะ (Asahikawa) ที่ฮอกไกโด อยากแนะนำ JRイン旭川　Jr INN Asahikawa มากกกกก เพราะที่นี่เป็นโรงแรมที่ดีที่สุดในเมืองนี้
ข้อดีที่สุดคืออยู่เชื่อมกับสถานีรถไฟ JR Asahikawa… เพิ่มเติม",,2017-02-22 12:10:00
674,,"['HashCorner', 'Mount Iō (Akan)']","ฮอกไกโดวันที่ 8 ทั้งหิมะพัดแบบแรงเบอร์ -17 องศา กับกลิ่นกัมมะถันจากภูเขาไฟ ตายไปเล้ยยยยย ชาทั้งตัวจนไม่อยากมีชีวิตอยู่แล้ว 😭
🚩 Mount Iō, Techikaga, Hokkaido
#Hokkaido #ExpediaTH",,2017-02-21 14:40:00
675,,['HashCorner'],คือแอพ Expedia ทำให้การเที่ยวง่ายขึ้นเยอะ จองโรงแรมสะดวกและยังถูกกว่าในเว็บ แถมตอนไปเที่ยวยังรวมข้อมูลโรงแรมทั้งทริปไว้ในแอพให้หมด วันเข้าพัก เวลาเช็คอิน และไม่ต้องปริ้นท์อะไรให้เสียเวลา ดีมั้ยล่ะ ถ้าดีลองโหลดและใช้แอพ Expedia ดูได้เล้ยยย #ExpediaTH,,2017-02-20 16:42:00
676,,"['HashCorner', 'อะบะชิริ']","ฮอกไกโดวันที่ 7 พร้อมลุ้ยยยยย~
📸: Abashiri Prison Museum",,2017-02-20 09:00:00
677,,"['HashCorner', 'อะบะชิริ']","พึ่งไปล่องเรือตัดน้ำแข็งที่เมืองอะบาชิริ ฮอกไกโดมา ที่นี่เป็นที่เดียวในญี่ปุ่นที่สามารถนั่งเรือดูแผ่นน้ำแข็งขั้วโลกที่ลอยมาจากรัสเซียได้แหละ สวยมากกกกกกกก
🚩Abashiri, Hokkaido #ExpediaTH",,2017-02-19 17:47:00
678,,"['HashCorner', 'Biei, Hokkaido']","ใช่ว่าคนเราไม่มีแฟน จะอยู่ไม่ได้ซักหน่อย อยู่คนเดียวโสดๆก็ใช้ชีวิตอยู่ได้สบายๆ แค่รักตัวเองและทำชีวิตให้แฮปปี้แค่นั้น :)
🚩Christmas Tree, Biei, Hokkaido ~
ต้นคริสมาสยืนต้นอยู่คนเดียวแบบแข็งแกร่งกลางเขาในเมืองบิเอะ ฮอกไกโด เฉิดฉายจนเป็นแลนด์มาร์คที่ทุกคนที่มาเที่ยวที่นี่ต้องมาถ่ายรูป #ExpediaTH",,2017-02-19 09:27:00
679,,"['HashCorner', 'Biei, Hokkaido']","วันนี้ไปลุย Biei ที่ฮอกไกโดมา เช่ารถขับแบบเก็บแลนด์มาร์คทุกจุดในบิเอะ อากาศโคตรหนาว หิมะแรงงโคตรโหด -10 องศา โห้ววววววววววว
รีวิวมาอยู่แล้ว แต่รอกลับไทยก่อนนะ โคตรดีเลยยย
#ExpediaTH",,2017-02-18 18:33:00
680,,['HashCorner'],"ครบรอบ 1 ปีที่ไป #ไต้หวันคนเดียว แล้วเฟ้ยย อาลีซาน สวยเว่อร์วังมาก แนะนำให้ไปช่วงเดือนกุมภาพันธ์ - มีนาคมเนี่ยแหละ หมอกดีงาม มีนามีซากุระด้วย ไปเลย ไปเลย
ดูรีวิวได้ที่ https://goo.gl/3puiCF",,2017-02-17 17:30:00
681,,['HashCorner'],"ฮอกไกโดวันที่ 4 : ภารกิจตามล่าหาเพนกวินที่ Asahiyama Zoo ยิปปี้ หิมะแรง~ แล้วก็คนไทยเยอะมากกกกก 55555 🐧
#ExpediaTH",,2017-02-17 13:06:00
682,,['HashCorner'],"ใครอยากดูรูปทริปฮอกไกโดครั้งนี้ ดูได้ใน Instagram ก๊อตนะคร้าบ ในนั้นจะอัพเรื่อยๆ โพสในเพจเยอะไป เก๊ากลัวโดนว่าาาาา ฮือ
@kotzhul น้อววว 📸
#ExpediaTH #Tripizee",,2017-02-16 21:03:00
683,,['HashCorner'],มาซัปโปโรต้องมาเมืองโอตารุแงะ เหมือนเป็นเมืองพี่เมืองน้อง มาก็ต้องมาดูคลอง คือมันเป็นฟีลโรแมนติก เสียดายไม่ได้มากับแฟน 555555555 #ExpediaTH,,2017-02-16 17:13:00
684,,"['HashCorner', 'Vessel Inn Sapporo Nakajimakoen']","「แนะนำโรงแรมในซัปโปโร #ExpediaTH」
ใครมีแพลนมาเที่ยวซัปโปโรที่ฮอกไกโด แนะนำโรงแรมนี่เล้ย Vessel Inn Sapporo ที่นี่ขึ้นชื่อเรื่องบุฟเฟต์อาหารเช้า ที่ถูกจัดว่าดีที่สุดอันดับที่ 13 ของญี่ปุ่นเลยทีเดียว… เพิ่มเติม",,2017-02-16 12:21:00
685,,"['HashCorner', 'Sapporo-shi, Hokkaido, Japan']",พออยู่เมืองหิมะอุณหภูมิ -10 ได้ซักพัก เราว่าอากาศแบบบ้านเราดีกว่าแง่ะ อยู่สบายกว่า อันนี้มันหนาวไป๊ หน้าชา มือชา ปากแห้ง แล้วน้ำแข็งเกาะพื้น คือลื่นมาก ต้องใช้ความเกร็งขาในการเดิน หิมะตกมา… เพิ่มเติม,,2017-02-15 20:19:00
686,,"['HashCorner', 'Former Hokkaidō Government Office']","แม่ถ่ายสวยจังเลย เย่~
ที่ทำการรัฐบาลเก่าฮอกไกโด มาที่ซัปโปโร ต้องถ่ายรูปหน้าตึกและเข้าไปพิพิธภัณฑ์ข้างในนะเฟ้ย ค่าเข้าฟรี รูปดาวบนตึกถือเป็นสัญลักษณ์ที่โด่งดังของซัปโปโร อย่าง Sapporo Beer ก็ใช้ โลโก้ดาวเหมือนกัน
#ExpediaTH #Tripizee",,2017-02-15 12:20:00
687,,"['HashCorner', 'さっぽろテレビ塔（Sapporo TV Tower）']","ทำงานกันอยู่ล่ะเซ่ ซัปโปโรมุมสูง มุมมหาชนที่ Sapporo TV Tower ขาวโพลนด้วยหิมะ สวยม๊ากกกก ❄️
#ExpediaTH #Tripizee",,2017-02-15 10:04:00
688,,"['HashCorner', 'Sapporo-shi, Hokkaido, Japan']","นี่เป็นครั้งแรกในชีวิตที่เห็นหิมะ ตลอดอายุ 26 ปีตั้งแต่เกิดมาเลยครับ หนาวมืองิก 5555555
#ExpediaTH #Tripizee🤘🏻",,2017-02-14 18:06:00
