,Place,Person,Post,Share,Date
174,,['HashCorner'],"KINTO : การเช่ารถระยะยาว ทางเลือกใหม่ที่คุ้มกว่าการซื้อ ⚡️
เอาดีๆ ก๊อตเองพึ่งรู้ไม่นานว่า #KINTO มีให้เช่ารถระยะยาวในรูปแบบบุคคลธรรมดาด้วย และที่น่าตื่นเต้นกว่า คือการได้รู้ว่า… เพิ่มเติม",,2020-10-30 12:00:00
175,,"['HashCorner', 'Phuket, Thailand']","ภูเก็ต / 6 พิกัด อยากให้ไป 🏖
หากใจเรียกร้องต้องการทะเล จะใจพัง เขาไม่รัก
หรือเหนื่อยหนัก กับชีวิตเดิมๆ นี่แนะนำให้เราเปลี่ยนทิศ
เที่ยวข้ามน้ำข้ามทะเลชิคๆ เพื่อไปเที่ยวให้ชีวิตปังๆ … เพิ่มเติม",,2020-10-29 12:02:00
176,,"['HashCorner', 'OZO North Pattaya']","𝗢𝗭𝗢 𝗡𝗼𝗿𝘁𝗵 𝗣𝗮𝘁𝘁𝗮𝘆𝗮 💙
โรงแรมที่นอนได้เต็มอิ่ม ตื่นมาก็พร้อมสนุกของจริง
ใครที่อยากเปลี่ยนที่นอน และเปลี่ยนบรรยากาศมาพักผ่อนที่พัทยาแบบชิลๆ โดยที่นั้นมีสิ่งอำนวยความสะดวกครบทุกความต้องการ มีที่นอนคุณภาพดีๆ… เพิ่มเติม",,2020-10-28 12:00:00
177,,['HashCorner'],"𝗧𝗵𝗲 𝗢𝗿𝗶𝗴𝗶𝗻 𝗟𝗮𝗱𝗽𝗿𝗮𝗼-𝗕𝗮𝗻𝗴𝗸𝗮𝗽𝗶
จากใจคนลาดพร้าว นี่ขอยกให้คอนโดนี้ดีเต็มสิบไม่หัก
ทำเลสุดปัง ติดถนนใหญ่ลาดพร้าว หน้ากว้าง 143 เมตร
ใกล้รถไฟฟ้าสายสีเหลือง สถานีบางกะปิ ในระยะ 111 เมตร… เพิ่มเติม",,2020-10-22 11:00:00
178,,['HashCorner'],"ความเชียงใหม่อ่ะ
มู๊ดจังหวัดนี้คือดีมากกกก 🧡
เอารีวิวมั้ยยยย 🙆🏻‍♂️
————
📸 IG: instagram.com/hashcorner",,2020-10-14 11:54:00
179,,['HashCorner'],"「น่าน 💚」
27 พิกัด ที่เที่ยวน่าน + ที่พักแบบจุใจ
ปีนี้ 'น่าน' ถือเป็นจังหวัดที่มาแรงมากก
มีดีด้วยธรรมชาติของภูเขาโอบล้อม น้ำตกฉ่ำๆ
ถนนลอยฟ้า ทุ่งนาเขียวๆ และที่พักสุดปัง
บอกเลยว่าดีงาม… เพิ่มเติม",,2020-10-12 19:11:00
180,,['HashCorner'],"ป่าบงเปียง แม่แจ่ม / เชียงใหม่
ถ้าให้พูดถึงนาขั้นบันไดที่สวยที่สุดในประเทศไทย ก๊อตเชื่อว่าหลายคนต้องนึกถึง ‘ป่าบงเปียง’ ที่อำเภอแม่แจ่ม จังหวัดเชียงใหม่ แน่นอน
… เพิ่มเติม",,2020-10-10 10:00:00
181,,"['HashCorner', 'Saran Nuch']","ช่วงนี้เหงาๆ ไม่รู้ทำไร วันนี้ก๊อตเลยออกมาเดินเล่น CentralPlaza Wetstgate ดู เดินไปเดินมา รู้ตัวอีกที ตัวเองหลงดันเข้ามาอยู่ใน Sport Zone เฉยเลย จะบอกว่าร้านค้าเยอะมาก ครบทุกอย่างที่สาย Sport ห้ามพลาดจริงๆ
… เพิ่มเติม",,2020-10-09 17:00:00
182,,['HashCorner'],"ไม่เคยไปวัดไหน แล้วรู้สึกว่าเจดีย์เค้าเท่ห์เท่านี้มาก่อน
เจดีย์ สีดำ-ทอง คือสวยมากกกกกกกก 🖤
📍 วัดบ้านเด่น / เชียงใหม่
–––––––
📸 IG: instagram.com/hashcorner",,2020-10-01 20:54:00
183,,['HashCorner'],"ว่างๆ รอบนี้ออกไปเดินเล่นทั้งในเมืองและสวนในกรุงเทพ ก๊อตเลยอยากสนุกลองเอาเสื้อผ้าของ 𝗨𝗻𝗶𝗾𝗹𝗼 มา 𝗠𝗶𝘅 & 𝗠𝗮𝘁𝗰𝗵 กัน
.
โดยตัวที่ก๊อตเลือกมาจะมีแจ็คเก็ตมีฮู้ด 𝗨𝗩 𝗣𝗿𝗼𝘁𝗲𝗰𝘁𝗶𝗼𝗻 ที่สามารถป้องกันรังสี 𝗨𝗩 ได้… เพิ่มเติม",,2020-09-28 17:00:00
184,,"['HashCorner', 'ก็ ก๊อคจิ จะใครล่ะ']","7 ที่พัก「น่าน」น่าไปนอนมากที่สุดตอนนี้
จากที่ก๊อตได้ไปเที่ยวน่านมาล่าสุดสองรอบ
จะบอกว่า ที่พักน่านคือเริ่ดและสุดปังมาก
ตั้งแต่เรื่องความสวย ด้วยวิวแบบเต็มสิบไม่หัก
หรือจะเป็นที่พักที่ถ่ายรูปกี่มุม ก็สวยทุกมุม
ลง… เพิ่มเติม",,2020-09-27 17:04:00
185,,['HashCorner'],"เชียงใหม่ ทักครับ 😆
📍 ป่าบงเปียง แม่แจ่ม / เชียงใหม่
–––––––––––––
📸 IG: instagram.com/hashcorner
🕊 Twitter: twitter.com/hashcorner",,2020-09-22 12:05:00
186,,['HashCorner'],"⚡️แจกห้องพัก 2 คืนที่ Thanyapura Sports & Health Resort Phuket
หากช่วงนี้ยังนึกไม่ออกว่าจะไปเที่ยวไหนดี นี่อยากให้ไปลองเข้าพักที่ธัญญปุระรีสอร์ท ที่ภูเก็ตเค้าดู เพราะนอกจากจะได้พักผ่อนที่ภูเก็ตแล้ว… เพิ่มเติม",,2020-09-18 09:00:00
187,,['HashCorner'],"ศรีนาม่าน (Srinaman) / น่าน
เห้ย นี่เป็นอีกโฮมสเตย์ที่ก๊อตโคตรอยากไปพักมาก หลังจากที่ได้ไปพักที่ กิ่วม่วงเมาน์เทนไฮแคมป์ มาเรียบร้อย (เจ้าของเดียวกัน) นั่นเองทำให้ก๊อตได้มาเที่ยวน่านอีกรอบ… เพิ่มเติม",,2020-09-15 16:20:00
188,,['HashCorner'],"จีน เป็นประเทศแรกๆ
ที่อยากไปเที่ยว หากเปิดประเทศแหละ 💙","ปักกิ่ง / จีน 🇨🇳
เมืองที่เราชอบมากที่สุดในจีน
เมืองเก๋ ที่ผสมผสานความอารยธรรมเก่าแก่
ความติสท์ และความโมเดิร์นได้อย่างลงตัวที่สุด
และไม่เหมือนที่ไหนในโลก
แม่มม โคตรชอบเลยเว้ย… เพิ่มเติม",2020-09-12 15:24:00
189,,"['HashCorner', 'สะปัน Riva camp']","ที่พักใหม่ในสะปัน ที่ทุกคนถามหาาา
สะปัน Riva camp รีวิวมาแล้วจ้าา
รอบนี้ก๊อตมาเที่ยวบ้านสะปันที่น่านอีกรอบ
และได้มีโอกาสมาพักที่ สะปัน Riva Camp
ที่ถือว่าเป็นที่พักใหม่ล่าสุดในหมู่บ้านสะปันเลย
… เพิ่มเติม",,2020-09-10 20:09:00
190,,['HashCorner'],"ช่วงนี้น่านสวยที่สุดของปีแล้วนะ
เขียวทั้งจังหวัดจริง ทุ่งนาคือสวยมากก
แล้วตอนเย็นคือแบบ นาเป็นสีทองเลยจ้า
โคตรสวยยยยยย 🧡
———
📸 IG: instagram.com/hashcorner
🎥 Tiktok: tiktok.com/@hashcorner
🕊 Twitter: twitter.com/hashcorner",,2020-09-08 08:30:00
191,,['HashCorner'],"หาดใหญ่ / สงขลา
ถือเป็นเมืองใหญ่ที่สุดของภาคใต้
เรื่องกินก็ดัง เรื่องที่เที่ยวก็สวย
และที่เก๋และก๊อตโคตรชอบเลยคือ
ความลงตัวของทุกสิ่ง ทั้งวัฒนธรรมและผู้คน
อย่างเช่น ที่นี่ทั้งวัดพุทธ มัสยิด และวัดจีน… เพิ่มเติม",,2020-09-07 10:00:00
192,,['HashCorner'],"คิดถึงอ่ะ คิดถึงการเที่ยวต่างประเทศมากกกก
นี่เลยรวม 7 รีวิวเที่ยวอังกฤษมาให้ ฮือ
ลอนดอน (x2) / บาธ / ยอร์ค /
เอดินบะระ / อินเวอร์เนสส์ / เกาะสกาย
เก็บไว้เที่ยวหลังเปิดประเทศได้เลย
แพลนมาครบทุกเมือง… เพิ่มเติม",,2020-09-02 15:11:00
193,,['HashCorner'],"น่าน แบบเขียวๆ
บอกเลยว่าโคตรดี!
สะปัน-ดอยสกาด-ศรีนาม่าน
รอรีวิวได้เลยจ้า 💚
📸 IG: instagram.com/hashcorner",,2020-09-01 15:30:00
194,,"['HashCorner', 'เทศบาลเมืองน่าน']","น่าน ทุ่งนาแบบเขียวมากกก
รีบไปเที่ยวตอนนี้เลย
ตั้งแต่ตอนนี้ถึงตุลาคมเนอะ
โคตรสวยยยยยย 💚
📍 บ้านสะปัน อ.บ่อเกลือ จ.น่าน
📸 IG: instagram.com/hashcorner",,2020-08-28 17:03:00
195,,"['HashCorner', 'เทศบาลเมืองน่าน']","น่าน ทักค้าบ 😆
มาเที่ยวน่านอีกแล้ว 5555
ถนนเลข 3 ~ ถนนลอยฟ้า จ.น่าน
📸 IG: instagram.com/hashcorner",,2020-08-27 09:45:00
196,,['HashCorner'],"[VLOG] สงขลา : หาดใหญ่-เกาะยอ-เมืองเก่าสงขลา
เห้ยย นี่คือ VLOG แรกของก๊อตเลยล่ะ
เจิมด้วยการพาพ่อ-แม่ เที่ยวสงขลา
ด้วยการเลี้ยงให้หมดเล้ย 55555
สงขลานี่เป็นจังหวัดที่กลมกล่อม เที่ยวโคตรสนุกมาก… เพิ่มเติม",,2020-08-25 17:00:00
197,,['HashCorner'],"- บ้านสะปัน จังหวัดน่าน -
หากเราอยากปลีกตัวออกจากความวุ่นวายในเมืองมาสัมผัสความสงบและเรียบง่าย ทั้งทุ่งนา น้ำตก โอบล้อมด้วยภูเขา สายหมอก และความน่ารักของคนท้องถิ่น ไม่ใช่ที่ไหน แต่ที่นี่คือบ้านสะปัน จังหวัดน่านนั่นเอง 💙
รีวิวสะปันบนเว็บ
https://bit.ly/2VJJDeM",,2020-08-19 16:25:00
198,,['HashCorner'],คิดถึงการไปเที่ยวต่างประเทศเนอะ 🥺,"รีวิว ไต้หวัน ทั่วประเทศ 🇹🇼
นี่คือรีวิวไต้หวันทั้งหมดจากที่ก๊อตได้ไปเที่ยว
ในรอบ 3 ปีที่ผ่านมา บอกเลยว่าสุดมาก
ครบทุกรสชาติทั้งตัวเมืองและธรรมชาติพีคๆ
วีซ่าไต้หวันเค้าฟรี แถมตอนนี้ค่าเงินบาทก็แข็ง เที่ยวได้ถูก… เพิ่มเติม",2020-08-09 12:57:00
199,,['HashCorner'],"ไปเที่ยวสุราษฎร์ ก็จะได้ IG โทนแบบนี้อ่ะ
ชอบมากกกกกก โอย 💙
–––
📸 IG: instagram.com/hashcorner
🦜 Twitter: twitter.com/hashcorner
🎥 Tiktok: tiktok.com/@hashcorner",,2020-08-02 12:00:00
200,,['HashCorner'],"บางทีกว่าจะได้รูปสวยๆ อย่างที่เห็น
ก็ต้องเซ็ตซีนหลายอย่างเหมือนกันน้าาา 😆
📍 Kew Muang Mountain High Camp จ.น่าน
รีวิว สันติสุข x น่าน : ตามรอยกิ่วม่วงแคมป์-ศรีนาม่าน
https://bit.ly/38zjzrY
–––––
📸 IG: instagram.com/hashcorner
🦜 Twitter: twitter.com/hashcorner
🎥 Tiktok: tiktok.com/@hashcorner",,2020-08-01 14:37:00
201,,['HashCorner'],"- เขื่อนเชี่ยวหลาน สุราษฎร์ธานี -
ไม่คิดเลยว่ามันจะสวยและดีมากขนาดนี้
ด้วยวิวของภูเขาสูงชันหลากหลายลูก
ตั้งอยู่กลางน้ำสีฟ้าแบบสวยๆ อลังการ
ทำให้ที่นี่ถูกขนานอีกชื่อหนึ่งว่า
‘กุ้ยหลินเมืองไทย’ ขนาดนั้นเลยล่ะ
… เพิ่มเติม",,2020-07-31 16:30:00
202,,"['HashCorner', 'Thongsuk Elephant Park']","สบายเลยน้า น้องช้างงง 🐘💙
นี่คือการได้ใกล้ชิดช้างมากที่สุดในชีวิต
โคตรน่ารักเลยยยยยยยย
ช่วงนี้ลองไปเที่ยวปางช้างกันนะครับ ไม่มีคนไปเยี่ยมน้องเลยตอนนี้ เพราะปกติมีแต่นักท่องเที่ยวต่างชาติ ที่มาเล่นกับน้อง… เพิ่มเติม",,2020-07-26 12:12:00
203,,"['HashCorner', 'Khao Sok National Park']","เขาสามเกลอ
แต่เรามีเธอคนเดียวนะ 🌝
📍 เขื่อนเชี่ยวหลาน จ.สุราษฎร์ธานี
#PanvareeTheGreenery
📸 IG: instagram.com/hashcorner",,2020-07-25 15:04:00
204,,['HashCorner'],"สวัสดีจากสุราษฎร์ครับ 😆
มาเที่ยวสุราษฎร์ครั้งแรกเล้ยยย
มีอะไรแนะนำบ้างมั้ยครับ
📸 IG: instagram.com/hashcorner",,2020-07-23 11:07:00
205,,['HashCorner'],"– บ้านรักไทย แม่ฮ่องสอน –
นี่เป็นอีกหมู่บ้านในแม่ฮ่องสอนที่ก๊อตโคตรหลงรัก
ไม่ว่าจะเป็นความสวยงามของหมู่บ้านที่มีเอกลักษณ์
ไม่เหมือนใครในสไตล์จีนยูนนาน พร้อมทะเลสาบสวยๆ
ผู้คนท้องถิ่นที่น่ารัก อาหารที่โคตรอร่อย… เพิ่มเติม",,2020-07-21 17:00:00
206,,['HashCorner'],"หัวหิน – เมื่อไหร่ที่คิดอยากเที่ยวทะเล 🌊
หรืออยากไปเที่ยวพักผ่อนตากอากาศไม่ไกลจากกรุงเทพ
นี่เชื่อเลยว่าชื่อของ ‘หัวหิน’ ป๊อปอัพขึ้นมาในใจด้วยแน่นอน
เพราะหัวหินอยู่ไม่ไกลจากกรุงเทพมาก นอกจากนี้เค้ายังขึ้นชื่อ… เพิ่มเติม",,2020-07-18 14:17:00
207,,['HashCorner'],"ไปเที่ยวบางแสนป่ะล่ะ ใกล้ๆ
ขี้เกียจไปไกล ขับรถแปปเดียวถึง ♥️",,2020-07-09 08:50:00
208,,['HashCorner'],"- กิ่วม่วง อ.สันติสุข จังหวัดน่าน -
ล่าสุดที่ได้ไปน่าน อยากชี้เป้าโฮมสเตย์สุดปัง
Kew Muang Mountain High Camp กิ่วม่วง เมาน์เทนไฮ แคมป์ บริการระดับ 5 ดาว และถ่ายรูปปังจนคนต้องตามรอย เดี๋ยวจะหาว่าเวอร์… เพิ่มเติม",,2020-07-08 16:14:00
209,,['HashCorner'],"ไปเที่ยวน่าน
ก็จะได้ IG โทนนี้ ☺️
📸 IG: instagram.com/hashcorner",,2020-07-07 14:54:00
210,,['HashCorner'],"- บ้านสะปัน จังหวัดน่าน -
นี่เป็นอีกที่ที่อยากแนะนำมากกกกก
หากเราอยากปลีกตัวออกจากความวุ่นวายในเมือง
มาสัมผัสความสงบและเรียบง่าย ทั้งทุ่งนา น้ำตก
โอบล้อมด้วยภูเขา สายหมอก และความน่ารักของคนท้องถิ่น
ไม่ใช่ที่ไหน… เพิ่มเติม",,2020-07-04 13:12:00
211,,['HashCorner'],"- บ่อเกลือ จังหวัดน่าน -
ไปเที่ยวให้ธรรมชาติช่วยให้เราผ่อนคลาย
ทั้งภูเขา ลำธาร และความเขียวของต้นไม้เนอะ 💚
📸 IG: instagram.com/hashcorner
🎥 Tiktok: tiktok.com/@hashcorner",,2020-06-30 17:09:00
212,,['HashCorner'],"ฮาวยูไลค์แดดดด 🌞
(นอนกลางแดดได้ เพื่อภาพที่สวย 5555)
📍 บ้านสะปัน จังหวัดน่าน
📸 IG: instagram.com/hashcorner
🎥 Tiktok: tiktok.com/@hashcorner",,2020-06-28 18:42:00
213,,"['HashCorner', 'Kew Muang Mountain High Camp กิ่วม่วงเมาน์เทนไฮแคมป์']","- กิ่วม่วง จังหวัดน่าน -
ไม่มีอะไรดีไปกว่าการตื่นขึ้นมา
แล้วเจอบรรยากาศแบบนี้ 💚
ฟินตาแตก กาแฟอร่อยกว่าเดิมล้านเท่า
📸 IG: instagram.com/hashcorner
🎥 Tiktok: tiktok.com/@hashcorner",,2020-06-27 09:00:00
214,,"['HashCorner', 'Arpo De Marng Resort']","ยืนตรงนั้นๆ
เดี๋ยวก๊อตถ่ายรูปให้ค้าบ 🌝
📍บ่อเกลือ - น่าน
📸 IG: instagram.com/hashcorner
🎥 Tiktok: tiktok.com/@hashcorner",,2020-06-26 19:27:00
215,,"['HashCorner', 'Kew Muang Mountain High Camp กิ่วม่วงเมาน์เทนไฮแคมป์']","สวัสดีวันพุธจากกิ่วม่วง น่านครับ
แด่คนทำงานวันนี้ อิอิ 🌝
📸 IG: instagram.com/hashcorner",,2020-06-24 09:06:00
216,,['HashCorner'],"ตอนนี้ก๊อตเที่ยวน่านอยู่ครับ
เป็นทริปไทยทริปแรกในรอบปี
เจิมที่แรกกับหมู่บ้านสะปัน จังหวัดน่าน
สวยมากกกกก สวยไม่จกตา
และสวยสู้ที่เที่ยวต่างประเทศได้สบาย
บอกเลยว่าตอนนี้ดีมากกกกกก
เพราะเป็นช่วงกำลังทำนา
เขียวๆ น้ำสะท้อนเลย 💚
📸 IG: instagram.com/hashcorner
🎥 Tiktok: tiktok.com/@hashcorner",,2020-06-23 11:49:00
217,,['HashCorner'],"แค่ได้มากินกาแฟที่เมลเบิร์น
ก็ถือว่าได้มาเยือนเมลเบิร์นเรียบร้อยแล้ว
บุญบาปคือ คาเฟ่โคตรดี
ราคากาแฟต่อแก้วถูกกว่าคาเฟ่ไทยไปอีก 😆",,2020-06-20 12:00:00
218,,['HashCorner'],"คิดถึงการเดินเทรลที่นิวซีแลนด์
โคตรของโคตรดี อยากไปให้ไปมากก 💙
📍 Lake Marian - เกาะใต้ นิวซีแลนด์
TikTok: tiktok.com/@hashcorner",,2020-06-19 13:08:00
219,,['HashCorner'],"แอบไปส่องดีลโรงแรมมา โอ้โหหห..
เหล่าบรรดาโรงแรม-รีสอร์ท 5 ดาวทั้งหลาย
คือราคาโคตรดี เรียกว่าเทกระจาด
นี่เลยคิดว่าช่วงนี้แหละ เหมาะแก่การเที่ยวไทยสุด
คนน้อยเพราะนักท่องเที่ยวจีนยังไม่โหมกระหน่ำเข้ามา… เพิ่มเติม",,2020-06-13 12:51:00
220,,['HashCorner'],"ฮานอย / เวียดนาม 🇻🇳
เที่ยวแบบ 3 วัน 2 คืน
เป็นเมืองที่สนุกอีกเมืองของเวียดนามนะ
มีสีสันด้วยความวุ่นวายแบบเวียดนาม
คาเฟ่ดีงาม กาแฟดี แถมแต่งสวยไปอีก
ชอบ ♥️",,2020-06-11 12:26:00
221,,['HashCorner'],"ลี่เจียง คือที่สุดอีกทริปของจีนเลย
รอไปเที่ยวจีนอีกรอบไม่ไหวแล้ววว 💙","ลี่เจียง (Lijiang) x ยูนนาน เที่ยวจีนต้องเที่ยวให้สุด 🇨🇳
ลี่เจียง (Lijiang) นี่ถือเป็นเมืองเริ่มต้นของทริป ลี่เจียง – แชงกรีล่า – ภูเขาหิมะเหม่ยลี่ (Lijiang – Shangri La – Meili Snow Mountain) ของทริปนี้เลยเด้อ… เพิ่มเติม",2020-06-10 17:12:00
222,,['HashCorner'],"ยอร์ค (York) / อีกเมืองน่ารักในอังกฤษ
ที่นี่มีตรอกถนนชื่อดัง The Shambles ที่เค้าบอกกันว่าเป็นตรอกที่สร้างแรงบันดาลใจและเป็นต้นแบบให้กับ ตรอกไดแอกอน (Diagon Alley) ใน Harry Potter นะเอ้อออ 🧙🏼‍♀️⚡️",,2020-06-05 14:53:00
