,Place,Person,Post,Share,Date
0,,['HashCorner'],"Like A Mountain 🍑
คาเฟ่ใหม่ในเขาใหญ่ ที่ฮอตสุดตอนนี้
ปล. ฝากเพจใหม่อีกเพจด้วยนะค้าบ
HashHopper จะเป็นสายคาเฟ่ และร้านอาหาร ครับโผมมมม","เขาใหญ่ทักจ้าา 🙋🏻‍♂️
Like A Mountain Khao Yai คาเฟ่น้องใหม่สไตล์เกาหลีสุดมินิมอล
บรรยากาศสบาย ถ่ายรูปมุมไหนก็ปัง
ร้านนี้เค้ามีทั้งโซน Indoor และ Outdoor เลยด้วย
Indoor ก็น่ารัก ดูคลีนๆ ได้มู้ดเกาหลีกรุบ … เพิ่มเติม",2021-12-02 13:14:00
1,,['HashCorner'],"FORWARDING HAPPINESS 2022 🎁🎄
ถึงเวลาดูแสงไฟและถ่ายรูปฉลองสิ้นปี
กับศูนย์การค้าเซ็นทรัลที่ส่งต่อพลังความสุข
แทนคำขอบคุณที่อยู่เคียงข้างกันมาตลอด 40 ปี
งานไฟต๊าซๆ อลังการแบบนี้ ปีนึงมีครั้งเดียว … เพิ่มเติม",,2021-12-01 11:12:00
2,,"['HashCorner', 'เขาใหญ่']","9 ที่เที่ยวเขาใหญ่ เก็บครบจบปิ๊ง 🌳🏞
ทั้งอุทยานแห่งชาติเขาใหญ่ คาเฟ่ และที่พักจาก Booking.com
โพสต์นี้มีกิจกรรมให้ร่วมสนุก เพื่อชิงรางวัลเครดิตท่องเที่ยว
มูลค่ารวม 55,000 บาทจาก Booking.com ด้วยนะ!
… เพิ่มเติม",,2021-11-30 08:48:00
3,,"['HashCorner', 'Future Park & Zpell']","THE HAPPINESS OF GIVING 🎁🎉
ส่งต่อความสุขส่งท้ายปี 2021 ไปกับ
Happy Gift Happy Gang ที่ Future Park และ Zpell
อีกหนึ่งช่วงเวลาพิเศษที่หลายคนนั้นรอคอย
นั่นก็คือช่วงสิ้นปีแบบนี้นี่แหละ … เพิ่มเติม",,2021-11-29 12:53:00
4,,['HashCorner'],"เที่ยวไทยยังไงให้เหมือนได้ไปญี่ปุ่น
ชิซึโอกะ ที่สุดของรสชาติชาญี่ปุ่นแท้ๆ 🍵
ไม่ว่าจะไปเที่ยวทริปไหนๆ
ก๊อตก็รู้สึกเหมือนได้ไปเที่ยวญี่ปุ่นตลอด
เพราะก๊อตพกชาชิซึโอกะไปด้วยทุกที่
… เพิ่มเติม",,2021-11-22 16:24:00
5,,"['HashCorner', 'ปักกิ่ง']","9 แลนด์มาร์คเมืองปักกิ่ง / จีน
จึ้งมากต้องปักหมุด 🇨🇳
ไม่เชื่อก็ต้องเชื่อว่าปักกิ่งเค้าสุดต๊าซมาก
เพราะนี่คือเมืองหลวงของจีน
ที่ผสมความขลังของประวัติศาสตร์
และความติสและโมเดิร์นได้จี๊ดสุด
นี่เลยอยากแนะนำ 9… เพิ่มเติม",,2021-11-21 15:00:00
6,,['HashCorner'],"5 สถานที่ ได้สัมผัสสงบ และผ่อนคลายใจกลางกรุงเทพ
Teyaki / สวนป่าเบญจกิติ / FIIKA. c&b / MOCA Museum of Contemporary Art / บ้านกลางเมือง The Edition สาทร-สุขสวัสดิ์
ปัจจุบันนี้รอบตัวเรามีแต่ความวุ่นวายเต็มไปหมด… เพิ่มเติม",,2021-11-17 17:39:00
7,,"['HashCorner', 'ไต้หวัน']","9 เหตุผลที่เราควรไปเที่ยวไต้หวันซักครั้งในชีวิต 🇹🇼
ใครไม่เคยไปไต้หวัน ก็ต้องมาอ่านแล้วแหละ เพราะไต้หวันเป็นอีกประเทศที่ควรค่าแก่การไปเที่ยวซักครั้งในชีวิตมาก ทั้งเรื่องกินที่มีของกินอร่อยๆในตลาดกลางคืนเยอะมาก… เพิ่มเติม",,2021-11-05 08:29:00
8,,['HashCorner'],"11 คาเฟ่สุดฮิตรอบกรุงเทพ ที่พลาดไม่ได้ 🍩 ☕️
อัดอั้นมานาน ในที่สุดเราก็ไปนั่งกินของอร่อยๆ ที่ร้านได้แล้ว
วันนี้ก๊อตเลยรวบรวม 11 คาเฟ่ ร้านสวยถ่ายรูปปัง และรสชาติอร่อย จากทั่วทุกสารทิศในกรุงเทพมาให้ทุกคนแล้ว… เพิ่มเติม",,2021-11-04 12:14:00
9,,"['HashCorner', ""The Original Swensen's-San Francisco""]","The Original Swensen's, San Francisco – California
ความตามล่าร้านสาขาแรกของโลกอะเนอะ 😋
ร้านนี้เป็นร้านสเวนเซ่นร้านแรกของโลก เปิดเมื่อปี 1948
ได้มาลองแล้ว อร่อยดีย์ 🍦
📸 : instagram.com/hashcorner
#อเมริกาคนเดียว",,2021-10-26 17:37:00
10,,"['HashCorner', 'ม่อนแจ่ม']","ม่อนแจ่ม เชียงใหม่ ⛰🌼
นี่ก็เดือนตุลาแล้วด้วย เข้าใกล้ช่วงปลายฝนต้นหนาวเข้ามาทุกที เผลอแปปเดียวก็จะหมดปีนี้แล้วอ่ะ ปลายปีแบบนี้..ภาคเหนือถือเป็นอีกจุดหมายปลายทางอันดับต้นๆ ที่คนไทยและต่างชาติอยากจะไปเที่ยวกัน… เพิ่มเติม",,2021-10-20 08:48:00
11,,['HashCorner'],"วันนี้จะมาบอกเคล็ดลับการเติมเต็มความสุขง่ายๆ ในระยะเวลาสั้นๆ ที่ทุกคนสามารถลองไปทำตามกันได้ในทุกวันด้วย NESCAFÉ RED CUP แก้วนี้
การได้เริ่มต้นวันที่ดีด้วยการฟังเพลงเพราะๆ และดื่มกาแฟสดดีๆ… เพิ่มเติม",,2021-10-19 08:00:00
12,,"['HashCorner', 'New York City, N.Y.']","อยู่นิวยอร์กแล้วน้าาา 🧡
เมืองสุดท้ายก่อนจบทริปอเมริกา 44 วัน เร็วมากก
ที่หายๆ ไปช่วงนี้ เพราะเที่ยวอยู่นี่แหละ 5555
ในนิวยอร์ก ใครมีอะไรเด็ดๆ แนะนำ
หรือต้องห้ามพลาดครับ 🙌🏻
เผื่อไปตามรอย 5555
📸 instagram.com/hashcorner
#อเมริกาคนเดียว",,2021-10-17 11:54:00
13,,"['HashCorner', 'ชิคาโก']","ชิคาโก้ (Chicago) x vivo X70 Pro 5G 🇺🇸
21 จุดเช็คอิน ต้องไปเมื่อได้มาเที่ยวชิคาโก้
ชิคาโก้ เมืองใหญ่อับดับ 3 ของอเมริกาที่ดังทั้งเรื่องสถาปัตยกรรมของตึกสูง และตอกย้ำความเก๋าด้วยแชมป์เก่า ตึกสูงที่สุดในโลกเกือบ… เพิ่มเติม",,2021-10-10 10:10:00
14,,"['HashCorner', 'Downey, California']","The Oldest McDonald’s - Downey, California
นี่เป็น McDonald’s แบบออริจินอลโดยพี่น้องแมคโดนัลด์ สาขาที่ 3 ของโลก (เปิดเมื่อปี 1953) และยังเป็นสาขาที่มีอายุมากที่สุดในโลกตอนนี้ที่ยังเปิดขายอยู่จนถึงปัจจุบันแหละ … เพิ่มเติม",,2021-10-05 10:09:00
15,,"['HashCorner', 'Disneyland/Califonia Adventure']","ไปดิสนีย์แลนด์มาทั้งหมด 5 ที่แล้ว ทั้งญี่ปุ่น จีน ฝรั่งเศส ฮ่องกง และอเมริกาที่แคลิฟอร์เนีย ซึ่งที่นี่แหละคือนัมเบอร์วันของก๊อตตอนนี้
ดีเริ่ดด เครื่องเล่นสนุก พร็อพฉาก แสงสีเสียงคือปัง ทั้ง Disneyland Park และ… เพิ่มเติม",,2021-10-04 15:48:00
16,,"['HashCorner', 'Life Asoke Hype']","LIFE ASOKE HYPE - THE FIRST BOUTIQUE CONDOMINIUM แห่งแรกในย่านพระราม 9
วันนี้ก๊อตจะพาทุกคนไปรู้จัก LIFE ASOKE HYPE คอนโดพร้อมอยู่ใจกลางย่าน CBD แห่งใหม่ของกรุงเทพ จากค่าย AP THAILAND ที่โดดเด่นด้วยการออกแบบ… เพิ่มเติม",,2021-09-20 10:00:00
17,,"['HashCorner', '안양 예술공원 Anyang Art Park']","สวนศิลปะอันยาง (Anyang Art Park) 🇰🇷 📸
สวนสาธารณะสุดคูลที่เป็น Instagrammable Spots ยอดฮิตของคนเกาหลี
ล่าสุดที่ก๊อตได้ไปเที่ยวเกาหลี ได้มีโอกาสไปเที่ยวสวนศิลปะอันยาง (Anyang Art Park) แล้วคือโคตรชอบ… เพิ่มเติม",,2021-09-17 18:00:00
18,,"['HashCorner', 'Atmoz Bangna']","เที่ยว + เลือกห้องคอนโดตามธาตุแบบ Everyday Vacation 🌱🌊🔥🌬️
ดิน น้ำ ลม ไฟ ต้องไปเที่ยวที่ไหน ห้องแบบไหนถึงปัง
หลังจากที่ก๊อตได้ไปเที่ยวมาหลายจังหวัด หลายประเทศ การท่องเที่ยวเป็นการเติมพลังชีวิตให้ก๊อตได้มาก… เพิ่มเติม",,2021-09-16 17:00:00
19,,"['HashCorner', 'Lijiang, Yunnan 雲南麗江']","Impressions Lijiang Show / ลี่เจียง - จีน 🇨🇳👲🏻
ขนลุก น้ำตาไหลกับการแสดงสุดอลังที่ซักครั้งในชีวิตต้องมาดู
ซึ่งแสดงโดยชาวบ้าน 10 ชนเผ่าพื้นเมืองในลี่เจียง
ถ้าใครที่มาเที่ยวลี่เจียง อย่าพลาดโชว์นี้เด็ดขาดเลยน้า… เพิ่มเติม",,2021-09-11 14:03:00
20,,"['HashCorner', 'ชิคาโก']","ฮัลโหลวววว ตอนนี้ก๊อตอยู่อเมริกานะครับ
นี่คือทริปอเมริกาคนเดียว
และเป็นอเมริกาครั้งแรก
อีกทั้งยังทริปเที่ยวต่างประเทศในรอบสองปี
และยังเป็นทริปที่ยาวนานที่สุดในชีวิต
จะรอด หรือไม่รอดน้าา 55555 😆
ยังไงติดตามทริปอเมริกาก๊อตได้นะครับ
จัดเต็มมมมมมมมม
IG: instagram.com/hashcorner
#อเมริกาคนเดียว",,2021-09-08 08:16:00
21,,"['HashCorner', 'Roborock Thailand']","Roborock H7 เครื่องดูดฝุ่นไร้สายรุ่นใหม่ล่าสุด 🙋🏻‍♂️
ที่จะทำให้เรารักการทำความสะอาดบ้านมากขึ้น
เพราะมันง่ายมากกกกกกก!
ใครที่คิดว่าการทำความสะอาดบ้านเป็นเรื่องวุ่นวายและใช้เวลานาน… เพิ่มเติม",,
22,,['HashCorner'],"Warner Bros. Studio Tour London – The Making of Harry Potter / ลอนดอน ⚡👓
สตูดิโอถ่ายหนังแฮร์รี่ พอตเตอร์ ที่แฟนพันธุ์แท้แฮรี่ห้ามพลาด !
ใครที่ติดตามแฮร์รี่ พอตเตอร์ (Harry Potter) มาตั้งแต่ภาคแรก… เพิ่มเติม",,2021-09-04 13:12:00
23,,['HashCorner'],"พาไปกินของอร่อยจาก 13 เมืองในญี่ปุ่น 🍙🍡
เชื่อว่าคนไทยส่วนใหญ่ชอบอาหารญี่ปุ่นม๊ากกก และก๊อตก็เป็นหนึ่งในนั้นเหมือนกัน ยิ่งเวลาไปญี่ปุ่น แล้วได้เจอทั้งขนม อาหารต่างๆ คือตื่นเต้นสุด
เอาเป็นว่า… เพิ่มเติม",,2021-09-03 16:33:00
24,,['HashCorner'],"วันนี้ก็อตจะมาเล่าที่มาที่ไปของกาแฟโคลอมเบียที่ว่าเกรดกาแฟระดับท็อปๆ ผ่าน NESCAFÉ GOLD CREMA COLOMBIA ARABICA ถ้วยนี้กันครับ
#โพสต์นี้มีกิจกรรมให้ร่วมสนุกด้วยน้า
… เพิ่มเติม",,2021-09-02 15:59:00
25,,['HashCorner'],"แม่ฮ่องสอน ☁️🍃
เมืองสามหมอก หรือที่รู้จักกันดีในชื่อ ‘แม่ฮ่องสอน’ อีกหนึ่งจังหวัดในภาคเหนือที่เป็นจุดหมายสำหรับการท่องเที่ยว ทั้งสายธรรมชาติ สายตั้งแคมป์ ที่ต้องรักที่นี่มากแน่ๆ… เพิ่มเติม",,2021-08-28 13:19:00
26,,"['HashCorner', 'Intercontinental Residences Hua Hin']","InterContinental Residences Hua Hin
คอนโดระดับ Super Luxury จาก Proud Real Estate
ที่ทำให้หัวหินเป็นบ้าน พร้อมบริการระดับโรงแรม 5 ดาว
เสมือนเราได้อยู่รีสอร์ทตลอด 24/7 ของชีวิต… เพิ่มเติม",,2021-08-27 12:40:00
27,,['HashCorner'],"บาธ x อังกฤษ 🇬🇧✨
เมืองโรงอาบน้ำโรมันโบราณ มาเที่ยวอังกฤษต้องมาเด้อ
บาธ (Bath) ถือเป็นอีกเมืองในอังกฤษที่ก๊อตชอบมากๆ และเชื่อเลยว่าถ้าใครที่ชอบสถาปัตยกรรมโรมันแบบดั้งเดิมต้องชอบที่นี่มากเหมือนกัน… เพิ่มเติม",,2021-08-24 18:51:00
28,,"['HashCorner', 'ไคเฟิง']","ไคเฟิง x จีน 🇨🇳 🐉
สาวกเปาบุ้นจิ้นต้องมาเที่ยวเมืองนี้แล้วววว!
เพราะเมืองไคเฟิงที่นี่เคยมีศาลไคฟงของจริง ซึ่งเป็นสถานที่ที่ท่านเปาได้ตัดสินคดีความ ผดุงความยุติธรรมแก่ประชาชน… เพิ่มเติม",,2021-08-22 13:17:00
29,,['HashCorner'],"ทะเลสาบเทคาโป x นิวซีแลนด์ 🦄🌈
สวยเว่อร์วัง เหมือนอยู่สวรรค์มากกก
ใครเป็นสายธรรมชาติเชิญมาทางนี้ ทะเลสาบเทคาโป (Lake Tekapo) หนึ่งในแลนด์มาร์คที่สุดในเกาะใต้นิวซีแลนด์ เรื่องความสวยนี่เกินบรรยาย… เพิ่มเติม",,2021-08-20 15:18:00
30,,['HashCorner'],"โอกินาว่า (Okinawa) x ญี่ปุ่น 🇯🇵🤿
เกาะที่ได้รับฉายาว่าเป็น ‘เกาะฮาวายแห่งประเทศญี่ปุ่น’ เป็นจังหวัดที่อยู่ทางใต้สุดของประเทศญี่ปุ่น และยังอยู่ใกล้กับไต้หวันมากด้วย
อยากจะบอกว่า ที่เที่ยวโอกินาว่านั้นดีย์จัด… เพิ่มเติม",,2021-08-15 14:15:00
31,,['HashCorner'],"สกอตแลนด์ / อังกฤษ 🏴󠁧󠁢󠁳󠁣󠁴󠁿✨
หากใครชอบความขลังของสถาปัตยกรรมยุโรป
แถมยังได้เที่ยว Road Trip แนวธรรมชาติสวยๆ
สกอตแลนด์คือคำตอบ เพราะที่นี่คือที่สุดของแลนด์สเคป
ให้ฟีลแบบหนัง Sci-fi… เพิ่มเติม",,2021-08-12 11:39:00
32,,['HashCorner'],"โซล x เกาหลี 🇰🇷⚡️
อันยองงง อยู่บ้านกันยาวๆ แบบนี้ต้องมีหลายคนที่ติดซีรีย์เกาหลีจนงอมแงมไปแล้วแน่ๆ ก๊อตเห็นเพื่อนนไอจีบางคนถึงขั้นว่าสั่งอาหารเกาหลีมากินไปดูไป ประหนึ่งว่าได้เป็นนางเอกซีรีย์ซะเอง อินเกิ๊น ฮ่าๆ… เพิ่มเติม",,2021-08-11 16:46:00
33,,['HashCorner'],"กลิ่นชาคั่วไฟ ที่สุดของความหอม มงลงมากก!
ชิซึโอกะ โฮจิฉะ สูตรหวานน้อย
น้องใหม่เพิ่ง On Shelf
ใครที่กำลังมองหาชารสเข้ม ที่มีรสหวานนิดๆ แนะนำเลยย
เปิดขวดมา กลิ่นชาคั่วฟุ้งๆ ฟินมาก
แถมดื่มแล้วยังนุ่มลิ้น… เพิ่มเติม",,2021-08-10 16:14:00
34,,['HashCorner'],"7 ที่พักน่านน่าไปพักผ่อน 💚✨
ในช่วงหลังๆ มานี้น่านเป็นอีกจังหวัดนึงที่กลายมาเป็นจังหวัดยอดฮิตของคนไทยไปแล้ว ยิ่งช่วงหน้าฝนแบบนี้ยิ่งเหมาะกับการไปเที่ยวและไปนอนพักที่น่านที่สุด… เพิ่มเติม",,2021-08-08 11:20:00
35,,['HashCorner'],"มาเที่ยวทิพย์ตามชื่อเพลงในแต่ละเมืองกันเถอะ 🎵✨
#HASHCORNCERxPLAYLIST
ช่วงนี้ยังไปเที่ยวไหนไม่ได้ WFHไป ฟังเพลงไป มันก็เพลินๆ ดีเหมือนกันนะ ก๊อตสังเกตได้ว่ามีหลายเพลงที่เค้าเอาชื่อเมืองจากหลายๆ… เพิ่มเติม",,2021-08-07 12:28:00
36,,['HashCorner'],"บริสเบน-โกลด์โคสต์ (Brisbane x Gold Coast) x ออสเตรเลีย 🌊🏄🏼‍♂️
ไปเทียวออสเตรเลียทั้งทีจะไปแค่ซิดนีย์กับเมลเบิร์นได้ยังไงกันละ ที่ออสยังมีเมืองที่ควรไปอย่างเมือง บริสเบน (Brisbane) อยู่นะจ๊ะ… เพิ่มเติม",,2021-08-06 13:13:00
37,,['HashCorner'],เราจะมีชีวิตรอดไปจนถึงปี 2022 ใช่ป่ะ 🥲,,2021-08-04 11:11:00
38,,"['HashCorner', 'ลาว']","อยู่ดีๆ ช่วงนี้ก็อยากไปเก็บเห็ดที่ลาว
บ้านเมืองเค้าสวยมากนะเอออ 🙋🏻‍♂
อ่านรีวิวเที่ยว ลาว แบบจุกๆ ได้เล้ย :
หลวงพระบาง : https://bit.ly/33kfXrT
หนองเขียว-เมืองงอย : https://bit.ly/3ys6bCc
ปากเซ : https://bit.ly/3A5r5at
–––––––––––
⛰ FB Group: เที่ยวต่างประเทศ : Hashcorner",,2021-08-03 16:45:00
39,,"['HashCorner', 'ไต้หวัน']","รีวิว ไต้หวัน ทั่วประเทศ 🇹🇼
นี่คือรีวิวไต้หวันทั้งหมดจากที่ก๊อตได้ไปเที่ยว
ในรอบ 3 ปีที่ผ่านมา บอกเลยว่าสุดมาก
ครบทุกรสชาติทั้งตัวเมืองและธรรมชาติพีคๆ
วีซ่าไต้หวันเค้าฟรี แถมตอนนี้ค่าเงินบาทก็แข็ง เที่ยวได้ถูก… เพิ่มเติม",,2021-08-01 14:34:00
40,,['HashCorner'],"ไครสต์เชิร์ช (Christchurch) x นิวซีแลนด์ 🇳🇿✨
ใครว่าเกาะใต้ของนิวซีแลนด์มีแต่ที่เที่ยวธรรมชาติ ถ้าอยากมาเที่ยวนิวซีแลนด์แบบฟีลเมือง เดินช้อปปิ้ง หาขอกินอร่อยๆ และไปฮ้อปปิ้งคาเฟ่ฮิตๆ ก๊อตคิดว่า ไครสต์เชิร์ช… เพิ่มเติม",,2021-07-31 15:37:00
41,,"['HashCorner', 'Phillip Island Nature Parks']","เกาะฟิลลิป (Phillip Island) x เมลเบิร์น ออสเตรเลีย 🐨🐧
ใครรักธรรมชาติและสัตว์น่ารักๆ ต้องห้ามพลาดเกาะฟิลลิป (Phillip Island) ที่อยู่ใกล้ๆ เมืองเมลเบิร์น ประเทศออสเตรเลียเชียวนะ เกาะนี้มีสัตว์คิ้วท์ๆเพียบบ… เพิ่มเติม",,2021-07-29 17:39:00
