,Place,Post,Share,Date,CPost,WPost,Page
195,,"ขอบคุณบทสัมภาษณ์ The Gaijin Trips แบกเป้เที่ยวคนเดียว
จากสำนัก #aday ด้วยครับ",,2020-06-21 12:51:00,ขอบคุณบทสัมภาษณ์TheGaijinTripsแบกเป้เที่ยวคนเดียวจากสำนัก#adayด้วยครับ,"['ขอบ', 'คุณบท', 'สัมภาษณ์', 'TheGaijinTrips', 'แบก', 'เป้', 'เที่ยว', 'คนเดียว', 'จาก', 'สำนัก', '#', 'aday', 'ด้วย', 'ครับ']",The Gaijin Trips แบกเป้เที่ยวคนเดียว
197,,"🔴 Live สดๆกันพรุ่งนี้กับ Gaijin X Raymac
กับการเดินทางของวันพรุ่งนี้ใน Road Trip
ตามสไตล์ The Plan is no Plan ของเรา
มาร่วมกันกำหนดเส้นทางให้เรา วันพรุ่งนี้ใน Live เวลา 8:00 เช้า
#TheGaijinTrips #Rayron #RayronGaijin",,2020-06-18 00:20:00,Liveสดๆกันพรุ่งนี้กับGaijinXRaymacกับการเดินทางของวันพรุ่งนี้ในRoadTripตามสไตล์ThePlanisnoPlanของเรามาร่วมกันกำหนดเส้นทางให้เราวันพรุ่งนี้ในLiveเวลา8:00เช้า#TheGaijinTrips#Rayron#RayronGaijin,"['Live', 'สดๆ', 'กัน', 'พรุ่งนี้', 'กับ', 'GaijinXRaymac', 'กับ', 'การ', 'เดินทาง', 'ของ', 'วันพรุ่งนี้', 'ใน', 'RoadTrip', 'ตาม', 'สไตล์', 'ThePlanisnoPlan', 'ของ', 'เรา', 'มา', 'ร่วมกัน', 'กำหนด', 'เส้นทาง', 'ให้', 'เรา', 'วันพรุ่งนี้', 'ใน', 'Live', 'เวลา', '8', ':', '00', 'เช้า', '#', 'TheGaijinTrips', '#', 'Rayron', '#', 'RayronGaijin']",The Gaijin Trips แบกเป้เที่ยวคนเดียว
198,,"อีกหนึ่งช่องทางในการติดตาม Youtube Chanel
อีต่อง ปิล๊อก EP3 The Gaijin Trips
ขอบคุณทุกๆคนที่ติดตามกันมานะครับ 🙏🙂",,2020-06-17 08:33:00,อีกหนึ่งช่องทางในการติดตามYoutubeChanelอีต่องปิล๊อกEP3TheGaijinTripsขอบคุณทุกๆคนที่ติดตามกันมานะครับ,"['อีก', 'หนึ่ง', 'ช่อง', 'ทางใน', 'การ', 'ติดตาม', 'YoutubeChanel', 'อี', 'ต่อ', 'งปิล๊อก', 'EP', '3', 'TheGaijinTrips', 'ขอบคุณ', 'ทุกๆ', 'คน', 'ที่', 'ติดตาม', 'กัน', 'มานะ', 'ครับ']",The Gaijin Trips แบกเป้เที่ยวคนเดียว
199,,"อีต่อง ปิล๊อก Solo Road Trip EP3 GAIJIN ROAD
หมู่บ้านแห่งมนต์เสน่ห์ที่ดึงดูดให้ผู้คนเดินทางไปเยือน อีต่อง เป็นหมู่บ้านเล็กๆที่ห้อมล้อมไปด้วยธรรมชาติและเรื่องราวภายในอดีตที่หลายคนหลงลืมไป นี่คงเป็นการเดินทาง… เพิ่มเติม",,2020-06-16 06:16:00,อีต่องปิล๊อกSoloRoadTripEP3GAIJINROADหมู่บ้านแห่งมนต์เสน่ห์ที่ดึงดูดให้ผู้คนเดินทางไปเยือนอีต่องเป็นหมู่บ้านเล็กๆที่ห้อมล้อมไปด้วยธรรมชาติและเรื่องราวภายในอดีตที่หลายคนหลงลืมไปนี่คงเป็นการเดินทางเพิ่มเติม,"['อี', 'ต่อ', 'งปิล๊อก', 'SoloRoadTripEP', '3', 'GAIJINROAD', 'หมู่บ้าน', 'แห่ง', 'มนต์', 'เสน่ห์', 'ที่', 'ดึงดูด', 'ให้', 'ผู้คน', 'เดินทาง', 'ไป', 'เยือน', 'อี', 'ต่อ', 'ง', 'เป็น', 'หมู่', 'บ้านเล็ก', 'ๆ', 'ที่', 'ห้อมล้อม', 'ไป', 'ด้วย', 'ธรรมชาติ', 'และ', 'เรื่องราว', 'ภายใน', 'อดีต', 'ที่', 'หลาย', 'คน', 'หลงลืม', 'ไป', 'นี่', 'คง', 'เป็นการ', 'เดินทาง', 'เพิ่มเติม']",The Gaijin Trips แบกเป้เที่ยวคนเดียว
200,,"Gaijin Podcast EP2 : เพื่อนชาวลาว
เรื่องเล่าระหว่างการเดินทางของผม เบนซ์ The Gaijin Trips กับการเดินทางเข้าสู่ประเทศลาวครั้งแรก และด้วยการเปลี่ยนแพลนการเดินทางกระทันหัน ทำให้ผมได้พบกับมิตรภาพระหว่างทาง… เพิ่มเติม",,2020-06-11 20:36:00,GaijinPodcastEP2:เพื่อนชาวลาวเรื่องเล่าระหว่างการเดินทางของผมเบนซ์TheGaijinTripsกับการเดินทางเข้าสู่ประเทศลาวครั้งแรกและด้วยการเปลี่ยนแพลนการเดินทางกระทันหันทำให้ผมได้พบกับมิตรภาพระหว่างทางเพิ่มเติม,"['GaijinPodcastEP', '2', ':', 'เพื่อน', 'ชาว', 'ลาว', 'เรื่องเล่า', 'ระหว่าง', 'การ', 'เดินทาง', 'ของ', 'ผม', 'เบนซ์', 'TheGaijinTrips', 'กับ', 'การ', 'เดินทาง', 'เข้าสู่', 'ประเทศ', 'ลาว', 'ครั้งแรก', 'และ', 'ด้วย', 'การ', 'เปลี่ยน', 'แพลน', 'การ', 'เดินทาง', 'กระทันหัน', 'ทำให้', 'ผม', 'ได้', 'พบ', 'กับ', 'มิตรภาพ', 'ระหว่างทาง', 'เพิ่มเติม']",The Gaijin Trips แบกเป้เที่ยวคนเดียว
201,,"อาทิตย์หน้าไปโร้ดทริปกันยาวๆกันที่บ้านอีต่องกันจ้า
#TheGaijinTrips #GaijinRoad #Rayron",,2020-06-10 19:11:00,อาทิตย์หน้าไปโร้ดทริปกันยาวๆกันที่บ้านอีต่องกันจ้า#TheGaijinTrips#GaijinRoad#Rayron,"['อาทิตย์', 'หน้า', 'ไป', 'โร้ด', 'ทริป', 'กัน', 'ยาว', 'ๆ', 'กันที่', 'บ้าน', 'อี', 'ต่อ', 'ง', 'กัน', 'จ้า', '#', 'TheGaijinTrips', '#', 'GaijinRoad', '#', 'Rayron']",The Gaijin Trips แบกเป้เที่ยวคนเดียว
202,,"How to ผูกมิตรกับหมาจร : Gaijin Inside
วันสบายๆกับการผูกมิตรกับหมาจรแถวบ้าน กับสิ่งที่หลายคนสงสัยว่าเราผูกมิตรกับหมาๆระหว่างทางยังไง เบาสมองกันวันละนิดจิตแจ่มใสนะครับ 🙂
#TheGaijinTrips #GaijinInside #Rayron",,2020-06-05 23:43:00,Howtoผูกมิตรกับหมาจร:GaijinInsideวันสบายๆกับการผูกมิตรกับหมาจรแถวบ้านกับสิ่งที่หลายคนสงสัยว่าเราผูกมิตรกับหมาๆระหว่างทางยังไงเบาสมองกันวันละนิดจิตแจ่มใสนะครับ#TheGaijinTrips#GaijinInside#Rayron,"['Howto', 'ผูกมิตร', 'กับ', 'หมา', 'จร', ':', 'GaijinInside', 'วัน', 'สบาย', 'ๆ', 'กับ', 'การ', 'ผูกมิตร', 'กับ', 'หมา', 'จร', 'แถว', 'บ้าน', 'กับ', 'สิ่ง', 'ที่', 'หลาย', 'คน', 'สงสัย', 'ว่า', 'เรา', 'ผูกมิตร', 'กับ', 'หมา', 'ๆ', 'ระหว่างทาง', 'ยังไง', 'เบาสมอง', 'กัน', 'วัน', 'ละ', 'นิด', 'จิต', 'แจ่มใส', 'นะ', 'ครับ', '#', 'TheGaijinTrips', '#', 'GaijinInside', '#', 'Rayron']",The Gaijin Trips แบกเป้เที่ยวคนเดียว
203,,"ไปเที่ยวเพชรบูรณ์กันมั้ย แล้วจะไปไหนก่อนดี จังหวัดนี้ที่เที่ยวสวยๆเยอะเหลือเกิน ไหนขอ Road Trip ไปดูสักหน่อยว่าจะสวยเหมือนที่เขาว่ารึเปล่า ไหนเราไปแว้น #เขาค้อ กับ #ภูทับเบิก กันหน่อยสิ
Camera Shoot by : #A7III #SonyThai #SonyDigitalCamera
#TheGaijinTrips #GaijinRoad #Rayron",,2020-06-04 14:13:00,ไปเที่ยวเพชรบูรณ์กันมั้ยแล้วจะไปไหนก่อนดีจังหวัดนี้ที่เที่ยวสวยๆเยอะเหลือเกินไหนขอRoadTripไปดูสักหน่อยว่าจะสวยเหมือนที่เขาว่ารึเปล่าไหนเราไปแว้น#เขาค้อกับ#ภูทับเบิกกันหน่อยสิCameraShootby:#A7III#SonyThai#SonyDigitalCamera#TheGaijinTrips#GaijinRoad#Rayron,"['ไปเที่ยว', 'เพชรบูรณ์', 'กัน', 'มั้ย', 'แล้', 'วจะ', 'ไป', 'ไหน', 'ก่อน', 'ดี', 'จังหวัด', 'นี้', 'ที่เที่ยว', 'สวย', 'ๆ', 'เยอะ', 'เหลือเกิน', 'ไหน', 'ขอ', 'RoadTrip', 'ไปดู', 'สักหน่อย', 'ว่า', 'จะ', 'สวย', 'เหมือน', 'ที่', 'เขา', 'ว่า', 'รึเปล่า', 'ไหน', 'เรา', 'ไป', 'แว้', 'น#', 'เขาค้อ', 'กับ', '#', 'ภู', 'ทับ', 'เบิก', 'กัน', 'หน่อย', 'สิ', 'CameraShootby', ':#', 'A', '7', 'III', '#', 'SonyThai', '#', 'SonyDigitalCamera', '#', 'TheGaijinTrips', '#', 'GaijinRoad', '#', 'Rayron']",The Gaijin Trips แบกเป้เที่ยวคนเดียว
204,,"ฝนตกๆแบบนี้นอนเที่ยวชิลล์อยู่บ้านกัน อีกหนึ่งช่องทางในการติดตาม
ผาหัวสิงห์ ภูทับเบิก Solo Road Trip EP2 : Youtube Chanel",,2020-06-02 10:01:00,ฝนตกๆแบบนี้นอนเที่ยวชิลล์อยู่บ้านกันอีกหนึ่งช่องทางในการติดตามผาหัวสิงห์ภูทับเบิกSoloRoadTripEP2:YoutubeChanel,"['ฝนตก', 'ๆ', 'แบบนี้', 'นอน', 'เที่ยว', 'ชิล', 'ล์', 'อยู่', 'บ้าน', 'กัน', 'อีก', 'หนึ่ง', 'ช่อง', 'ทางใน', 'การ', 'ติดตาม', 'ผา', 'หัว', 'สิงห์', 'ภู', 'ทับ', 'เบิก', 'SoloRoadTripEP', '2', ':', 'YoutubeChanel']",The Gaijin Trips แบกเป้เที่ยวคนเดียว
205,,"ผาหัวสิงห์ ภูทับเบิก Solo Road Trip EP2 GAIJIN ROAD
หลังจากเดินทาง Road trip มายังเขาค้อแล้ว จุดที่พลาดไม่ได้อีกก็คงจะอยู่ไม่ห่างไปสักเท่าไหร่ ผาหัวสิงห์ในเขตของภูทับเบิก จุดที่รายล้อมไปด้วยเส้นทางที่สวยงามและทิวทัศน์ที่ตราตรึง
IG : Thegaijintrips
ติดต่อโฆษณาได้ที่ Facebook Fanpage : https://www.facebook.com/rayron.tv",,2020-06-01 07:42:00,ผาหัวสิงห์ภูทับเบิกSoloRoadTripEP2GAIJINROADหลังจากเดินทางRoadtripมายังเขาค้อแล้วจุดที่พลาดไม่ได้อีกก็คงจะอยู่ไม่ห่างไปสักเท่าไหร่ผาหัวสิงห์ในเขตของภูทับเบิกจุดที่รายล้อมไปด้วยเส้นทางที่สวยงามและทิวทัศน์ที่ตราตรึงIG:Thegaijintripsติดต่อโฆษณาได้ที่FacebookFanpage:https://www.facebook.com/rayron.tv,"['ผา', 'หัว', 'สิงห์', 'ภู', 'ทับ', 'เบิก', 'SoloRoadTripEP', '2', 'GAIJINROAD', 'หลังจาก', 'เดินทาง', 'Roadtrip', 'มายัง', 'เขาค้อ', 'แล้ว', 'จุด', 'ที่', 'พลาด', 'ไม่', 'ได้', 'อีก', 'ก็', 'คงจะ', 'อยู่', 'ไม่', 'ห่าง', 'ไป', 'สัก', 'เท่าไหร่', 'ผา', 'หัว', 'สิงห์', 'ใน', 'เขต', 'ของ', 'ภู', 'ทับ', 'เบิก', 'จุด', 'ที่', 'รายล้อม', 'ไป', 'ด้วย', 'เส้นทาง', 'ที่', 'สวยงาม', 'และ', 'ทิวทัศน์', 'ที่', 'ตราตรึง', 'IG', ':', 'Thegaijintrips', 'ติดต่อ', 'โฆษณา', 'ได้ที่', 'FacebookFanpage', ':', 'https', '://', 'www', '.', 'facebook', '.', 'com', '/', 'rayron', '.', 'tv']",The Gaijin Trips แบกเป้เที่ยวคนเดียว
206,,"Live🎬 The Gaijin Trips
เจาะลึกถึงเนื้อหาการถ่ายทำผ่านเพจ
Misterbeam",BeamTalk: ผู้ชายคนนี่คือคนที่ เดินทางคนเดียวครับ ถ่ายทำคนเดียว ตัดต่อคนเดียว จนสร้างรายการท่องเที่ยวที่มีคนตามกว่า 3แสนใน youtube ซึ่งผมบอกเลยว่าอยากให้ทุกคนเข้ามาดู live… เพิ่มเติม,2020-05-28 20:00:00,LiveTheGaijinTripsเจาะลึกถึงเนื้อหาการถ่ายทำผ่านเพจMisterbeam,"['LiveTheGaijinTrips', 'เจาะลึก', 'ถึง', 'เนื้อหา', 'การถ่ายทำ', 'ผ่าน', 'เพจ', 'Misterbeam']",The Gaijin Trips แบกเป้เที่ยวคนเดียว
207,,2ทุ่มคืนนี้ Live พูดคุยกับ Gaijin ผ่านเพจ Misterbeam กันจ้า แล้วพบกันนะครับ,BeamTalk: ผู้ชายคนนี่คือคนที่ เดินทางคนเดียวครับ ถ่ายทำคนเดียว ตัดต่อคนเดียว จนสร้างรายการท่องเที่ยวที่มีคนตามกว่า 3แสนใน youtube ซึ่งผมบอกเลยว่าอยากให้ทุกคนเข้ามาดู live… เพิ่มเติม,2020-05-28 14:33:00,2ทุ่มคืนนี้LiveพูดคุยกับGaijinผ่านเพจMisterbeamกันจ้าแล้วพบกันนะครับ,"['2', 'ทุ่ม', 'คืนนี้', 'Live', 'พูดคุย', 'กับ', 'Gaijin', 'ผ่าน', 'เพจ', 'Misterbeam', 'กัน', 'จ้า', 'แล้ว', 'พบกัน', 'นะ', 'ครับ']",The Gaijin Trips แบกเป้เที่ยวคนเดียว
208,,"Gaijin Podcast EP1 : ความตาย ณ ดอยอินทนนท์
ถึงผู้ที่ชื่นชอบการฟังทุกท่าน ผมหวังว่าเรื่องเล่าในการเดินทางของผมที่ถูกขยายออกผ่านเสียงในรูปแบบ Podcast จะช่วยเติมเต็มให้กับผู้ที่ติดตาม The Gaijin Trips… เพิ่มเติม",,2020-05-27 18:57:00,GaijinPodcastEP1:ความตายณดอยอินทนนท์ถึงผู้ที่ชื่นชอบการฟังทุกท่านผมหวังว่าเรื่องเล่าในการเดินทางของผมที่ถูกขยายออกผ่านเสียงในรูปแบบPodcastจะช่วยเติมเต็มให้กับผู้ที่ติดตามTheGaijinTripsเพิ่มเติม,"['GaijinPodcastEP', '1', ':', 'ความตาย', 'ณ', 'ดอย', 'อินทนนท์', 'ถึง', 'ผู้', 'ที่', 'ชื่นชอบ', 'การ', 'ฟัง', 'ทุกท่าน', 'ผม', 'หวัง', 'ว่า', 'เรื่องเล่า', 'ใน', 'การ', 'เดินทาง', 'ของ', 'ผม', 'ที่', 'ถูก', 'ขยาย', 'ออก', 'ผ่าน', 'เสียง', 'ใน', 'รูปแบบ', 'Podcast', 'จะ', 'ช่วย', 'เติมเต็ม', 'ให้', 'กับ', 'ผู้', 'ที่', 'ติดตาม', 'TheGaijinTrips', 'เพิ่มเติม']",The Gaijin Trips แบกเป้เที่ยวคนเดียว
209,,"ลัดเลาะเข้าไปยังภูทับเบิกในมุมที่เรียบง่ายไปกับเรา ต้นเดือนหน้า
The Gaijin Trips ผาหัวสิงห์ Solo Road Trip EP2",,2020-05-26 20:53:00,ลัดเลาะเข้าไปยังภูทับเบิกในมุมที่เรียบง่ายไปกับเราต้นเดือนหน้าTheGaijinTripsผาหัวสิงห์SoloRoadTripEP2,"['ลัดเลาะ', 'เข้าไป', 'ยัง', 'ภู', 'ทับ', 'เบิก', 'ใน', 'มุม', 'ที่', 'เรียบง่าย', 'ไป', 'กับ', 'เรา', 'ต้นเดือน', 'หน้า', 'TheGaijinTrips', 'ผา', 'หัว', 'สิงห์', 'SoloRoadTripEP', '2']",The Gaijin Trips แบกเป้เที่ยวคนเดียว
210,,"เบื้องหลังการบินโดรนติดตาม ตามภาษาอีสานบ้านเฮา
โดรนขยับผิดพลาดเล็กน้อย ใจหายแว้บเลยจ้า
#TheGaijinTrips #Rayron #GaijinRoad",,2020-05-22 10:56:00,เบื้องหลังการบินโดรนติดตามตามภาษาอีสานบ้านเฮาโดรนขยับผิดพลาดเล็กน้อยใจหายแว้บเลยจ้า#TheGaijinTrips#Rayron#GaijinRoad,"['เบื้องหลัง', 'การ', 'บิน', 'โดรน', 'ติดตาม', 'ตาม', 'ภาษา', 'อีสาน', 'บ้าน', 'เฮา', 'โดรน', 'ขยับ', 'ผิดพลาด', 'เล็กน้อย', 'ใจหาย', 'แว้บ', 'เลย', 'จ้า', '#', 'TheGaijinTrips', '#', 'Rayron', '#', 'GaijinRoad']",The Gaijin Trips แบกเป้เที่ยวคนเดียว
211,,"อีกหนึ่งช่องทางในการติดตามครับ
เขาค้อ Road Trip EP1
ขอบคุณทุกๆคนที่ติดตามนะครับ 🙏🙂",,2020-05-17 22:45:00,อีกหนึ่งช่องทางในการติดตามครับเขาค้อRoadTripEP1ขอบคุณทุกๆคนที่ติดตามนะครับ,"['อีก', 'หนึ่ง', 'ช่อง', 'ทางใน', 'การ', 'ติดตาม', 'ครับ', 'เขาค้อ', 'RoadTripEP', '1', 'ขอบคุณ', 'ทุกๆ', 'คน', 'ที่', 'ติดตาม', 'นะ', 'ครับ']",The Gaijin Trips แบกเป้เที่ยวคนเดียว
212,,"เขาค้อ Solo Road Trip EP1 GAIJIN ROAD
การเดินทางแบบ Road Tip เข้าสู่ เขาค้อ จังหวัดเพชรบูรณ์ เพียงลำพัง 2วัน1คืน เป็นสิ่งที่ผมได้เริ่มเรียนรู้การเดินทางด้วย2ล้อระยะทางไกลเป็นครั้งแรก… เพิ่มเติม",,2020-05-16 07:19:00,เขาค้อSoloRoadTripEP1GAIJINROADการเดินทางแบบRoadTipเข้าสู่เขาค้อจังหวัดเพชรบูรณ์เพียงลำพัง2วัน1คืนเป็นสิ่งที่ผมได้เริ่มเรียนรู้การเดินทางด้วย2ล้อระยะทางไกลเป็นครั้งแรกเพิ่มเติม,"['เขาค้อ', 'SoloRoadTripEP', '1', 'GAIJINROAD', 'การ', 'เดินทาง', 'แบบ', 'RoadTip', 'เข้าสู่', 'เขาค้อ', 'จังหวัด', 'เพชรบูรณ์', 'เพียงลำพัง', '2', 'วัน', '1', 'คืน', 'เป็น', 'สิ่ง', 'ที่', 'ผม', 'ได้', 'เริ่ม', 'เรียนรู้', 'การ', 'เดินทาง', 'ด้วย', '2', 'ล้อ', 'ระยะ', 'ทางไกล', 'เป็นครั้งแรก', 'เพิ่มเติม']",The Gaijin Trips แบกเป้เที่ยวคนเดียว
213,,"📌พูดคุยกันตอบปัญหากันครับ
จะพยายามตอบทุกๆคอมเม้นเด้อ🙏😄",,2020-05-14 19:28:00,พูดคุยกันตอบปัญหากันครับจะพยายามตอบทุกๆคอมเม้นเด้อ,"['พูดคุย', 'กัน', 'ตอบ', 'ปัญหา', 'กัน', 'ครับ', 'จะ', 'พยายาม', 'ตอบ', 'ทุกๆ', 'คอม', 'เม้น', 'เด้อ']",The Gaijin Trips แบกเป้เที่ยวคนเดียว
214,,"📌Gaijin LIVE
ไหนคืนนี้มาคุยกันหน่อยนะ
ตั้งแต่ทำเพจมาไม่เคยได้ตอบใครเลย
คืนนี้จะมาตอบทุกคนบ้างแล้วครับ
จะพยายามตอบทุกคอมเม้นนะคร้าบ
19:30-20:30 🙏😄",,2020-05-14 17:03:00,GaijinLIVEไหนคืนนี้มาคุยกันหน่อยนะตั้งแต่ทำเพจมาไม่เคยได้ตอบใครเลยคืนนี้จะมาตอบทุกคนบ้างแล้วครับจะพยายามตอบทุกคอมเม้นนะคร้าบ19:30-20:30,"['GaijinLIVE', 'ไหน', 'คืนนี้', 'มา', 'คุย', 'กัน', 'หน่อย', 'นะ', 'ตั้งแต่', 'ทำ', 'เพจ', 'มา', 'ไม่', 'เคย', 'ได้', 'ตอบ', 'ใคร', 'เลย', 'คืนนี้', 'จะ', 'มา', 'ตอบ', 'ทุกคน', 'บ้าง', 'แล้ว', 'ครับ', 'จะ', 'พยายาม', 'ตอบ', 'ทุก', 'คอม', 'เม้น', 'นะ', 'คร้าบ', '19', ':', '30', '-', '20', ':', '30']",The Gaijin Trips แบกเป้เที่ยวคนเดียว
