,Place,Post,Share,Date,CPost,WPost,Page
107,,"The Gaijin Trips แบกเป้เที่ยวคนเดียว EP48 ภูชี้ฟ้า 2วัน2คืน
เส้นทางที่ไม่เรียบง่ายกับการแบกเป้เที่ยวคนเดียวที่ไม่มีพาหนะเป็นของตัวเอง การโบกรถและการเดินทางที่ต้องพึ่งพาผู้อื่นจึงเป็นเรื่องสำคัญที่สุด ณ ขณะนั้น… เพิ่มเติม",,2021-01-15 10:48:00,TheGaijinTripsแบกเป้เที่ยวคนเดียวEP48ภูชี้ฟ้า2วัน2คืนเส้นทางที่ไม่เรียบง่ายกับการแบกเป้เที่ยวคนเดียวที่ไม่มีพาหนะเป็นของตัวเองการโบกรถและการเดินทางที่ต้องพึ่งพาผู้อื่นจึงเป็นเรื่องสำคัญที่สุดณขณะนั้นเพิ่มเติม,"['TheGaijinTrips', 'แบก', 'เป้', 'เที่ยว', 'คนเดียว', 'EP', '48', 'ภู', 'ชี้ฟ้า', '2', 'วัน', '2', 'คืน', 'เส้นทาง', 'ที่', 'ไม่', 'เรียบง่าย', 'กับ', 'การ', 'แบก', 'เป้', 'เที่ยว', 'คนเดียว', 'ที่', 'ไม่', 'มี', 'พาหนะ', 'เป็น', 'ของ', 'ตัวเอง', 'การ', 'โบก', 'รถ', 'และ', 'การ', 'เดินทาง', 'ที่', 'ต้อง', 'พึ่งพา', 'ผู้อื่น', 'จึง', 'เป็น', 'เรื่องสำคัญ', 'ที่สุด', 'ณ', 'ขณะนั้น', 'เพิ่มเติม']",The Gaijin Trips แบกเป้เที่ยวคนเดียว
108,,"Rayron X Gaijin ExtraScene บทที่4
พี่เรเกือบลืมลง 😂🙏",,2021-01-10 08:34:00,RayronXGaijinExtraSceneบทที่4พี่เรเกือบลืมลง,"['RayronXGaijinExtraScene', 'บท', 'ที่', '4', 'พี่', 'เร', 'เกือบ', 'ลืม', 'ลง']",The Gaijin Trips แบกเป้เที่ยวคนเดียว
109,,Gaijin in สตูล EP47 อีกหนึ่งช่องทางในการติดตามครับ,,2021-01-05 11:29:00,GaijininสตูลEP47อีกหนึ่งช่องทางในการติดตามครับ,"['Gaijinin', 'สตูล', 'EP', '47', 'อีก', 'หนึ่ง', 'ช่อง', 'ทางใน', 'การ', 'ติดตาม', 'ครับ']",The Gaijin Trips แบกเป้เที่ยวคนเดียว
110,,"The Gaijin Trips แบกเป้เที่ยวคนเดียว EP47 สตูล GEOPARK 2วัน 1คืน
อีกหนึ่งดินแดนที่เต็มไปด้วยเรื่องราวของอดีตกาลของการกำเนิดโลกซึ่งดูจะไกลตัวเมื่อได้พูดถึง แต่เมื่อการเดินทางกลับไปยังจังหวัดสตูลครั้งนี้… เพิ่มเติม",,2021-01-04 07:24:00,TheGaijinTripsแบกเป้เที่ยวคนเดียวEP47สตูลGEOPARK2วัน1คืนอีกหนึ่งดินแดนที่เต็มไปด้วยเรื่องราวของอดีตกาลของการกำเนิดโลกซึ่งดูจะไกลตัวเมื่อได้พูดถึงแต่เมื่อการเดินทางกลับไปยังจังหวัดสตูลครั้งนี้เพิ่มเติม,"['TheGaijinTrips', 'แบก', 'เป้', 'เที่ยว', 'คนเดียว', 'EP', '47', 'สตูล', 'GEOPARK', '2', 'วัน', '1', 'คืน', 'อีก', 'หนึ่ง', 'ดินแดน', 'ที่', 'เต็มไปด้วย', 'เรื่องราว', 'ของ', 'อดีตกาล', 'ของ', 'การ', 'กำเนิด', 'โลก', 'ซึ่ง', 'ดูจะ', 'ไกล', 'ตัว', 'เมื่อ', 'ได้', 'พูดถึง', 'แต่', 'เมื่อ', 'การ', 'เดินทาง', 'กลับ', 'ไป', 'ยัง', 'จังหวัด', 'สตูล', 'ครั้งนี้', 'เพิ่มเติม']",The Gaijin Trips แบกเป้เที่ยวคนเดียว
111,,"สวัสดีปี 2021 กับการเดินทางครั้งใหม่ ในช่วงที่โควิดระบาดและการเดินทางที่ทุลักทุเล ถ้าผ่านเรื่องยากๆเหล่านี้ไปแล้ว หวังว่าทุกคนคงจะได้ใช้ชีวิตในแบบที่ตัวเองต้องการได้นะครับ ขอให้ทุกท่านสุขภาพแข็งแรงและปลอดภัยในทุกวันครับ
Photo date 1.1.21
#HNY #TheGaijinTrips",,2021-01-01 13:45:00,สวัสดีปี2021กับการเดินทางครั้งใหม่ในช่วงที่โควิดระบาดและการเดินทางที่ทุลักทุเลถ้าผ่านเรื่องยากๆเหล่านี้ไปแล้วหวังว่าทุกคนคงจะได้ใช้ชีวิตในแบบที่ตัวเองต้องการได้นะครับขอให้ทุกท่านสุขภาพแข็งแรงและปลอดภัยในทุกวันครับPhotodate1.1.21#HNY#TheGaijinTrips,"['สวัสดี', 'ปี', '2021', 'กับ', 'การ', 'เดินทาง', 'ครั้ง', 'ใหม่', 'ใน', 'ช่วง', 'ที่', 'โควิด', 'ระบาด', 'และ', 'การ', 'เดินทาง', 'ที่', 'ทุลักทุเล', 'ถ้า', 'ผ่าน', 'เรื่อง', 'ยาก', 'ๆ', 'เหล่านี้', 'ไป', 'แล้ว', 'หวัง', 'ว่า', 'ทุกคน', 'คงจะ', 'ได้', 'ใช้ชีวิต', 'ใน', 'แบบ', 'ที่', 'ตัวเอง', 'ต้องการ', 'ได้', 'นะ', 'ครับ', 'ขอให้', 'ทุกท่าน', 'สุขภาพ', 'แข็งแรง', 'และ', 'ปลอดภัย', 'ใน', 'ทุกวัน', 'ครับ', 'Photodate', '1.1.21', '#', 'HNY', '#', 'TheGaijinTrips']",The Gaijin Trips แบกเป้เที่ยวคนเดียว
112,,"วันพักผ่อนกับการเดินทางที่ยาวนาน ณ บางแสน วันนี้คงเป็นวันที่ต้องเซ็ตระบบทั้งคนทั้งรถใหม่ โดยรถแม่บ้านที่ต้องการการดูแลไปกับน้ำมันเครื่อง Shell Advance AX7
ซึ่งใครสนใจที่จะดูแลเครื่องยนตร์ด้วยน้ำมันเครื่อง… เพิ่มเติม",,2020-12-25 14:28:00,วันพักผ่อนกับการเดินทางที่ยาวนานณบางแสนวันนี้คงเป็นวันที่ต้องเซ็ตระบบทั้งคนทั้งรถใหม่โดยรถแม่บ้านที่ต้องการการดูแลไปกับน้ำมันเครื่องShellAdvanceAX7ซึ่งใครสนใจที่จะดูแลเครื่องยนตร์ด้วยน้ำมันเครื่องเพิ่มเติม,"['วัน', 'พักผ่อน', 'กับ', 'การ', 'เดินทาง', 'ที่', 'ยาวนาน', 'ณ', 'บาง', 'แสน', 'วันนี้', 'คง', 'เป็น', 'วันที่', 'ต้อง', 'เซ็ต', 'ระบบ', 'ทั้งคน', 'ทั้ง', 'รถ', 'ใหม่', 'โดย', 'รถ', 'แม่บ้าน', 'ที่', 'ต้องการ', 'การ', 'ดูแล', 'ไป', 'กับ', 'น้ำมันเครื่อง', 'ShellAdvanceAX', '7', 'ซึ่ง', 'ใคร', 'สนใจ', 'ที่จะ', 'ดูแล', 'เครื่อง', 'ยนตร์', 'ด้วย', 'น้ำมันเครื่อง', 'เพิ่มเติม']",The Gaijin Trips แบกเป้เที่ยวคนเดียว
113,,"ไปกันต่อ!!!!
กับ Scene ที่ยังไม่ได้เล่า กับเรื่องราวที่คุณยังไม่ได้เห็น ใน Extra scene บทที่ 3",,2020-12-24 10:11:00,ไปกันต่อ!!!!กับSceneที่ยังไม่ได้เล่ากับเรื่องราวที่คุณยังไม่ได้เห็นในExtrasceneบทที่3,"['ไป', 'กัน', 'ต่อ', '!!!!', 'กับ', 'Scene', 'ที่', 'ยัง', 'ไม่', 'ได้', 'เล่า', 'กับ', 'เรื่องราว', 'ที่', 'คุณ', 'ยัง', 'ไม่', 'ได้', 'เห็น', 'ใน', 'Extrascene', 'บท', 'ที่', '3']",The Gaijin Trips แบกเป้เที่ยวคนเดียว
114,,"สิ้นสุดการเดินทางกับ กรุงเทพ-เบตง บที่4 ขอบคุณทุกท่านที่ติดตามเรามา
อีกหนึ่งช่องทางในการติดตาม Gaijin Chanel",,2020-12-23 10:52:00,สิ้นสุดการเดินทางกับกรุงเทพ-เบตงบที่4ขอบคุณทุกท่านที่ติดตามเรามาอีกหนึ่งช่องทางในการติดตามGaijinChanel,"['สิ้นสุด', 'การ', 'เดินทาง', 'กับ', 'กรุงเทพ', '-', 'เบตง', 'บ', 'ที่', '4', 'ขอบคุณ', 'ทุกท่าน', 'ที่', 'ติดตาม', 'เรา', 'มา', 'อีก', 'หนึ่ง', 'ช่อง', 'ทางใน', 'การ', 'ติดตาม', 'GaijinChanel']",The Gaijin Trips แบกเป้เที่ยวคนเดียว
115,,"ปลายทางข้างหน้าคงอีกไม่ไกล บทสรุปของการเดินทางจะออกมาในรูปแบบไหนในการเดินทางกว่า14วันจากกรุงเทพมายังเบตง ติดตามกันในบทสรุปสุดท้าย บทที่4
#กรุงเทพเบตง #RayronXGaijin",,2020-12-22 17:51:00,ปลายทางข้างหน้าคงอีกไม่ไกลบทสรุปของการเดินทางจะออกมาในรูปแบบไหนในการเดินทางกว่า14วันจากกรุงเทพมายังเบตงติดตามกันในบทสรุปสุดท้ายบทที่4#กรุงเทพเบตง#RayronXGaijin,"['ปลายทาง', 'ข้างหน้า', 'คง', 'อีก', 'ไม่', 'ไกล', 'บทสรุป', 'ของ', 'การ', 'เดินทาง', 'จะ', 'ออกมา', 'ใน', 'รูปแบบ', 'ไหน', 'ใน', 'การ', 'เดินทาง', 'กว่า', '14', 'วัน', 'จาก', 'กรุงเทพ', 'มายัง', 'เบตง', 'ติดตาม', 'กัน', 'ใน', 'บทสรุป', 'สุดท้าย', 'บท', 'ที่', '4', '#', 'กรุงเทพ', 'เบตง', '#', 'RayronXGaijin']",The Gaijin Trips แบกเป้เที่ยวคนเดียว
116,,"RayronXGaijin Extra Scene บทที่ 2
Scene ที่ยังไม่ได้เล่า กับเรื่องราวที่คุณยังไม่ได้เห็น
#กรุงเทพเบตง #RayronXGaijin #roadtrip",,2020-12-18 09:55:00,RayronXGaijinExtraSceneบทที่2Sceneที่ยังไม่ได้เล่ากับเรื่องราวที่คุณยังไม่ได้เห็น#กรุงเทพเบตง#RayronXGaijin#roadtrip,"['RayronXGaijinExtraScene', 'บท', 'ที่', '2', 'Scene', 'ที่', 'ยัง', 'ไม่', 'ได้', 'เล่า', 'กับ', 'เรื่องราว', 'ที่', 'คุณ', 'ยัง', 'ไม่', 'ได้', 'เห็น', '#', 'กรุงเทพ', 'เบตง', '#', 'RayronXGaijin', '#', 'roadtrip']",The Gaijin Trips แบกเป้เที่ยวคนเดียว
117,,"บทที่3 เริ่มเข้าสู่ความเข้มข้นขึ้นทุกที ระยะทางคงอีกไม่ไกลแล้วที่จะไปยังจุดหมาย #กรุงเทพเบตง #RayronXGaijin
อีกหนึ่งช่องทางในการติดตาม",,2020-12-16 10:50:00,บทที่3เริ่มเข้าสู่ความเข้มข้นขึ้นทุกทีระยะทางคงอีกไม่ไกลแล้วที่จะไปยังจุดหมาย#กรุงเทพเบตง#RayronXGaijinอีกหนึ่งช่องทางในการติดตาม,"['บท', 'ที่', '3', 'เริ่ม', 'เข้าสู่', 'ความ', 'เข้มข้น', 'ขึ้น', 'ทุกที', 'ระยะทาง', 'คง', 'อีก', 'ไม่', 'ไกล', 'แล้ว', 'ที่จะ', 'ไป', 'ยัง', 'จุดหมาย', '#', 'กรุงเทพ', 'เบตง', '#', 'RayronXGaijin', 'อีก', 'หนึ่ง', 'ช่อง', 'ทางใน', 'การ', 'ติดตาม']",The Gaijin Trips แบกเป้เที่ยวคนเดียว
118,,"เมื่อการเดินทางเริ่มให้สิ่งที่แปลกใหม่ การแยกทางกันของเบนซ์และพี่เร จะดำเนินไปในทิศทางไหน ติดตามกันได้ในบทที่3
#กรุงเทพเบตง #RayronXGaijin",,2020-12-15 18:10:00,เมื่อการเดินทางเริ่มให้สิ่งที่แปลกใหม่การแยกทางกันของเบนซ์และพี่เรจะดำเนินไปในทิศทางไหนติดตามกันได้ในบทที่3#กรุงเทพเบตง#RayronXGaijin,"['เมื่อ', 'การ', 'เดินทาง', 'เริ่ม', 'ให้', 'สิ่ง', 'ที่', 'แปลกใหม่', 'การ', 'แยกทาง', 'กัน', 'ของ', 'เบนซ์', 'และ', 'พี่', 'เร', 'จะ', 'ดำเนิน', 'ไป', 'ใน', 'ทิศทาง', 'ไหน', 'ติดตาม', 'กัน', 'ได้', 'ใน', 'บท', 'ที่', '3', '#', 'กรุงเทพ', 'เบตง', '#', 'RayronXGaijin']",The Gaijin Trips แบกเป้เที่ยวคนเดียว
119,,"เต็มอิ่มกับ กรุงเทพ-เบตง บทที่1ไปแล้ว มาผ่อนคลายกับอีกมุมหนึ่งของการเดินทางที่ยังคงมีอีกหลายอย่างที่เรายังไม่ได้เล่าให้ฟัง ทั้งหมดอยู่ใน EXTRA scene บทที่1 นี้แล้ว
#กรุงเทพเบตง #RayronXGaijin
https://youtu.be/q57S6sFrBhA",,2020-12-13 19:51:00,เต็มอิ่มกับกรุงเทพ-เบตงบทที่1ไปแล้วมาผ่อนคลายกับอีกมุมหนึ่งของการเดินทางที่ยังคงมีอีกหลายอย่างที่เรายังไม่ได้เล่าให้ฟังทั้งหมดอยู่ในEXTRAsceneบทที่1นี้แล้ว#กรุงเทพเบตง#RayronXGaijinhttps://youtu.be/q57S6sFrBhA,"['เต็มอิ่ม', 'กับ', 'กรุงเทพ', '-', 'เบตง', 'บท', 'ที่', '1', 'ไป', 'แล้ว', 'มา', 'ผ่อนคลาย', 'กับ', 'อีก', 'มุม', 'หนึ่ง', 'ของ', 'การ', 'เดินทาง', 'ที่', 'ยังคง', 'มี', 'อีก', 'หลายอย่าง', 'ที่', 'เรา', 'ยัง', 'ไม่', 'ได้', 'เล่า', 'ให้', 'ฟัง', 'ทั้งหมด', 'อยู่', 'ใน', 'EXTRAscene', 'บท', 'ที่', '1', 'นี้', 'แล้ว', '#', 'กรุงเทพ', 'เบตง', '#', 'RayronXGaijinhttps', '://', 'youtu', '.', 'be', '/', 'q', '57', 'S', '6', 'sFrBhA']",The Gaijin Trips แบกเป้เที่ยวคนเดียว
120,,"📍Finaly 13-12-20
❤️ 431
💙 742
ผลสรุปนี้เราจะลง EXTRA scene บทที่1 ให้ท่านชมในเร็ววันนี้จ้า
📍ร่วม VOTE ทางเลือกในการรับชมคลิปแยกของไทม์ไลน์ กรุงเทพ-เบตง
❤️1. มีการรวมคลิปเป็น Full EP ฉบับโคตรเต็ม ลงช่วงปีใหม่
💙… เพิ่มเติม",,2020-12-11 10:41:00,Finaly13-12-20431742ผลสรุปนี้เราจะลงEXTRAsceneบทที่1ให้ท่านชมในเร็ววันนี้จ้าร่วมVOTEทางเลือกในการรับชมคลิปแยกของไทม์ไลน์กรุงเทพ-เบตง1.มีการรวมคลิปเป็นFullEPฉบับโคตรเต็มลงช่วงปีใหม่เพิ่มเติม,"['Finaly', '13', '-', '12', '-', '20431742', 'ผลสรุป', 'นี้', 'เรา', 'จะ', 'ลง', 'EXTRAscene', 'บท', 'ที่', '1', 'ให้', 'ท่าน', 'ชม', 'ใน', 'เร็ว', 'วันนี้', 'จ้า', 'ร่วม', 'VOTE', 'ทางเลือก', 'ใน', 'การ', 'รับ', 'ชม', 'คลิป', 'แยก', 'ของ', 'ไทม์', 'ไลน์', 'กรุงเทพ', '-', 'เบตง', '1.', 'มี', 'การ', 'รวม', 'คลิป', 'เป็น', 'FullEP', 'ฉบับ', 'โคตร', 'เต็ม', 'ลง', 'ช่วง', 'ปีใหม่', 'เพิ่มเติม']",The Gaijin Trips แบกเป้เที่ยวคนเดียว
121,,"ใครยังไม่ได้ดู อย่าลืมอู้งานไปดูจ้า 😂
กับอีกหนึ่งช่องทางในการติดตาม บทที่2
Rayron X Gaijin กรุงเทพ-เบตง",,2020-12-09 10:08:00,ใครยังไม่ได้ดูอย่าลืมอู้งานไปดูจ้ากับอีกหนึ่งช่องทางในการติดตามบทที่2RayronXGaijinกรุงเทพ-เบตง,"['ใคร', 'ยัง', 'ไม่', 'ได้', 'ดู', 'อย่า', 'ลืม', 'อู้', 'งาน', 'ไปดู', 'จ้า', 'กับ', 'อีก', 'หนึ่ง', 'ช่อง', 'ทางใน', 'การ', 'ติดตาม', 'บท', 'ที่', '2', 'RayronXGaijin', 'กรุงเทพ', '-', 'เบตง']",The Gaijin Trips แบกเป้เที่ยวคนเดียว
122,,"เรื่องราวกำลังเข้มข้น!! ปลายทางเป็นแค่จุดหมาย
ระหว่างทางคงจะเป็นเสน่ห์ที่ยากจะลืม
มาลุ้นกันว่าจะจบมั้ย ไปกันทางไหน ไปได้ยังไง และเจอะเจอผู้ใด ในเรื่องราวการเดินทางในบทที่ 2 ครั้งนี้กับ กรุงเทพ-เบตง บทที่2
#กรุงเทพเบตง #RayronXGaijin",,2020-12-08 17:54:00,เรื่องราวกำลังเข้มข้น!!ปลายทางเป็นแค่จุดหมายระหว่างทางคงจะเป็นเสน่ห์ที่ยากจะลืมมาลุ้นกันว่าจะจบมั้ยไปกันทางไหนไปได้ยังไงและเจอะเจอผู้ใดในเรื่องราวการเดินทางในบทที่2ครั้งนี้กับกรุงเทพ-เบตงบทที่2#กรุงเทพเบตง#RayronXGaijin,"['เรื่องราว', 'กำลัง', 'เข้มข้น', '!!', 'ปลายทาง', 'เป็น', 'แค่', 'จุดหมาย', 'ระหว่างทาง', 'คงจะ', 'เป็น', 'เสน่ห์', 'ที่', 'ยาก', 'จะ', 'ลืม', 'มา', 'ลุ้น', 'กัน', 'ว่า', 'จะ', 'จบ', 'มั้ย', 'ไป', 'กัน', 'ทาง', 'ไหน', 'ไป', 'ได้', 'ยังไง', 'และ', 'เจอะ', 'เจอ', 'ผู้ใด', 'ใน', 'เรื่องราว', 'การ', 'เดิน', 'ทางใน', 'บท', 'ที่', '2', 'ครั้งนี้', 'กับ', 'กรุงเทพ', '-', 'เบตง', 'บท', 'ที่', '2', '#', 'กรุงเทพ', 'เบตง', '#', 'RayronXGaijin']",The Gaijin Trips แบกเป้เที่ยวคนเดียว
123,,ขอบคุณบทสัมภาษณ์จาก #TheJobs ทางช่อง #AmarinTV ด้วยจ้า,หากคุณเคยคิดว่าบล็อกเกอร์ท่องเที่ยวจะต้องมีทีมงานหลายคน.. วันนี้ #TheJobs จะพาไปรู้จักกับเบนซ์ ไกจิน บล็อกเกอร์ท่องเที่ยว ที่เริ่มจากการแบกเป้ไปเที่ยวคนเดียวตั้งแต่เหนือจรดใต้ คิดบทเอง พากษ์เสียงเอง ถ่ายทำและตัดต่อเอง ตั้งใจทำเป็นไดอารี่ชีวิตของตนเอง แต่กลับสร้างแรงบันดาลใจให้กับผู้คนมากมายที่ได้รับชม!!!!,2020-12-05 12:14:00,ขอบคุณบทสัมภาษณ์จาก#TheJobsทางช่อง#AmarinTVด้วยจ้า,"['ขอบ', 'คุณบท', 'สัมภาษณ์', 'จาก', '#', 'TheJobs', 'ทาง', 'ช่อง', '#', 'AmarinTV', 'ด้วย', 'จ้า']",The Gaijin Trips แบกเป้เที่ยวคนเดียว
124,,เดินทางร่วมกันมาหมดแล้วกับรถแต่ละรุ่นของ Cub House วันนี้เบนซ์และพี่เร ขอพาทัวร์ที่บูท Motor Expo 2020 กันหน่อยนะ 😄,ที่บูธรถจักรยานยนต์ฮอนด้า ในงาน Motor Expo 2020 ณ IMPACT เมืองทองธานี,2020-12-04 19:21:00,เดินทางร่วมกันมาหมดแล้วกับรถแต่ละรุ่นของCubHouseวันนี้เบนซ์และพี่เรขอพาทัวร์ที่บูทMotorExpo2020กันหน่อยนะ,"['เดินทาง', 'ร่วมกัน', 'มา', 'หมด', 'แล้ว', 'กับ', 'รถ', 'แต่ละ', 'รุ่น', 'ของ', 'CubHouse', 'วันนี้', 'เบนซ์', 'และ', 'พี่', 'เร', 'ขอ', 'พา', 'ทัวร์', 'ที่', 'บูท', 'MotorExpo', '2020', 'กัน', 'หน่อย', 'นะ']",The Gaijin Trips แบกเป้เที่ยวคนเดียว
