,Place,Post,Share,Date,CPost,WPost,Page
0,,"The Gaijin Trips แบกเป้เที่ยวคนเดียว EP67 เปียงซ้อ 3วัน2คืน
การเดินทางกลับมายังจังหวัดน่านเพราะความสงสัยในเส้นทางที่ไม่เคยได้ไปถึง เปียงซ้อเป็นอีกจุดหมายที่เราเคยได้ยินผ่านหูจากชาวบ้านโดยบังเอิญ… เพิ่มเติม",,2021-11-30 06:33:00,TheGaijinTripsแบกเป้เที่ยวคนเดียวEP67เปียงซ้อ3วัน2คืนการเดินทางกลับมายังจังหวัดน่านเพราะความสงสัยในเส้นทางที่ไม่เคยได้ไปถึงเปียงซ้อเป็นอีกจุดหมายที่เราเคยได้ยินผ่านหูจากชาวบ้านโดยบังเอิญเพิ่มเติม,"['TheGaijinTrips', 'แบก', 'เป้', 'เที่ยว', 'คนเดียว', 'EP', '67', 'เปีย', 'ง', 'ซ้อ', '3', 'วัน', '2', 'คืน', 'การ', 'เดินทาง', 'กลับ', 'มายัง', 'จังหวัด', 'น่าน', 'เพราะ', 'ความสงสัย', 'ใน', 'เส้นทาง', 'ที่', 'ไม่', 'เคย', 'ได้', 'ไป', 'ถึง', 'เปีย', 'ง', 'ซ้อ', 'เป็น', 'อีก', 'จุดหมาย', 'ที่', 'เรา', 'เคย', 'ได้ยิน', 'ผ่าน', 'หู', 'จาก', 'ชาวบ้าน', 'โดยบังเอิญ', 'เพิ่มเติม']",The Gaijin Trips แบกเป้เที่ยวคนเดียว
1,,ใครยังไม่ได้ไปดู สามารถดูและติดตามกันได้นะครับในอีกหนึ่งช่องทาง YouTube Chanel กับ EP67 เปียงซ้อ จ้า🙏😄,,2021-12-01 17:58:27,ใครยังไม่ได้ไปดูสามารถดูและติดตามกันได้นะครับในอีกหนึ่งช่องทางYouTubeChanelกับEP67เปียงซ้อจ้า,"['ใคร', 'ยัง', 'ไม่', 'ได้', 'ไปดู', 'สามารถ', 'ดู', 'และ', 'ติดตาม', 'กัน', 'ได้', 'นะ', 'ครับ', 'ใน', 'อีก', 'หนึ่ง', 'ช่องทาง', 'YouTubeChanel', 'กับ', 'EP', '67', 'เปีย', 'ง', 'ซ้อ', 'จ้า']",The Gaijin Trips แบกเป้เที่ยวคนเดียว
3,,EP67 เปียงซ้อ ไปแอ่วน่านกันให้สุดปลายทางกับ 2 ล้อ เร็วๆนี้จ้า 😄,,2021-11-28 11:42:00,EP67เปียงซ้อไปแอ่วน่านกันให้สุดปลายทางกับ2ล้อเร็วๆนี้จ้า,"['EP', '67', 'เปีย', 'ง', 'ซ้อ', 'ไป', 'แอ่ว', 'น่าน', 'กัน', 'ให้', 'สุด', 'ปลายทาง', 'กับ', '2', 'ล้อ', 'เร็ว', 'ๆ', 'นี้', 'จ้า']",The Gaijin Trips แบกเป้เที่ยวคนเดียว
4,,อีกหนึ่งช่องทางในการติดตาม EP66 โป่งแรด จันทบุรี อีกหนึ่งการเดินทางสบายๆในภาคตะวันออก 🙂,,2021-11-17 17:38:00,อีกหนึ่งช่องทางในการติดตามEP66โป่งแรดจันทบุรีอีกหนึ่งการเดินทางสบายๆในภาคตะวันออก,"['อีก', 'หนึ่ง', 'ช่อง', 'ทางใน', 'การ', 'ติดตาม', 'EP', '66', 'โป่ง', 'แรด', 'จันทบุรี', 'อีก', 'หนึ่ง', 'การ', 'เดินทาง', 'สบาย', 'ๆ', 'ใน', 'ภาค', 'ตะวันออก']",The Gaijin Trips แบกเป้เที่ยวคนเดียว
5,,"The Gaijin Trips แบกเป้เที่ยวคนเดียว EP66 โป่งแรด จันทบุรี 2วัน1คืน
อีกครั้งกับการเดินทางไปยังจังหวัดจันทบุรี ซึ่งยังคงมีอีกหลายจุดที่ใช้แผนที่จากปากของชาวบ้าน ครั้งนี้กับการเดินทางเข้าสู่โป่งแรด… เพิ่มเติม",,2021-11-16 08:32:00,TheGaijinTripsแบกเป้เที่ยวคนเดียวEP66โป่งแรดจันทบุรี2วัน1คืนอีกครั้งกับการเดินทางไปยังจังหวัดจันทบุรีซึ่งยังคงมีอีกหลายจุดที่ใช้แผนที่จากปากของชาวบ้านครั้งนี้กับการเดินทางเข้าสู่โป่งแรดเพิ่มเติม,"['TheGaijinTrips', 'แบก', 'เป้', 'เที่ยว', 'คนเดียว', 'EP', '66', 'โป่ง', 'แรด', 'จันทบุรี', '2', 'วัน', '1', 'คืน', 'อีกครั้ง', 'กับ', 'การ', 'เดินทาง', 'ไป', 'ยัง', 'จังหวัด', 'จันทบุรี', 'ซึ่ง', 'ยังคง', 'มี', 'อีก', 'หลาย', 'จุด', 'ที่', 'ใช้', 'แผนที่', 'จาก', 'ปาก', 'ของ', 'ชาวบ้าน', 'ครั้งนี้', 'กับ', 'การ', 'เดินทาง', 'เข้าสู่', 'โป่ง', 'แรด', 'เพิ่มเติม']",The Gaijin Trips แบกเป้เที่ยวคนเดียว
6,,ขอบคุณบทสัมภาษณ์จาก Ad Addict หลังจากที่ได้รับรางวัล Best Travel Influencer ในปี 2021 นี้ครับ,"“เราไม่ได้เป็นนักท่องเที่ยว แต่เราคือนักเล่าเรื่อง” รู้จัก The Gaijin Trips กับคุณเบนซ์-ถาวร อดีตมนุษย์โปรดักชั่นผู้ผันตัวมาเป็นนักเดินทาง (อ่านเพิ่มเติม : https://bit.ly/3c5K5eY) [ADclusive]
.… เพิ่มเติม",2021-11-15 11:14:00,ขอบคุณบทสัมภาษณ์จากAdAddictหลังจากที่ได้รับรางวัลBestTravelInfluencerในปี2021นี้ครับ,"['ขอบ', 'คุณบท', 'สัมภาษณ์', 'จาก', 'AdAddict', 'หลังจากที่', 'ได้', 'รับรางวัล', 'BestTravelInfluencer', 'ใน', 'ปี', '2021', 'นี้', 'ครับ']",The Gaijin Trips แบกเป้เที่ยวคนเดียว
7,,กลางเดือนไปแว้นกันกับ EP66 โป่งแรด@จันทบุรี จ้า💨,,2021-11-12 20:33:00,กลางเดือนไปแว้นกันกับEP66โป่งแรด@จันทบุรีจ้า,"['กลางเดือน', 'ไป', 'แว้', 'น', 'กัน', 'กับ', 'EP', '66', 'โป่ง', 'แรด', '@', 'จันทบุรี', 'จ้า']",The Gaijin Trips แบกเป้เที่ยวคนเดียว
8,,"ในช่วง Lockdown ที่ผ่านมา หลายคนคงต้องหยุดอยู่ที่บ้านจนหงอยเหงาไปตามๆกัน รวมทั้งตัวผมก็เช่นกัน ที่ทำได้แค่ดูแลรถอยู่บ้านและใช้ชีวิตไปกับครอบครัว ซึ่งคงเป็นอีกช่วงเวลาหนึ่งที่ผมได้บันทึกเก็บไว้
#ShellAdvancePower
#ShellAdvanceCity
#เลือกไปให้สุดในแบบคุณ
#มอเตอร์ไซค์แบบไหนก็เลือกใช้เชลล์แอ๊ดว้านซ์",,2021-11-04 18:05:00,ในช่วงLockdownที่ผ่านมาหลายคนคงต้องหยุดอยู่ที่บ้านจนหงอยเหงาไปตามๆกันรวมทั้งตัวผมก็เช่นกันที่ทำได้แค่ดูแลรถอยู่บ้านและใช้ชีวิตไปกับครอบครัวซึ่งคงเป็นอีกช่วงเวลาหนึ่งที่ผมได้บันทึกเก็บไว้#ShellAdvancePower#ShellAdvanceCity#เลือกไปให้สุดในแบบคุณ#มอเตอร์ไซค์แบบไหนก็เลือกใช้เชลล์แอ๊ดว้านซ์,"['ใน', 'ช่วง', 'Lockdown', 'ที่ผ่านมา', 'หลาย', 'คน', 'คง', 'ต้อง', 'หยุด', 'อยู่', 'ที่', 'บ้าน', 'จน', 'หงอยเหงา', 'ไป', 'ตาม', 'ๆ', 'กัน', 'รวม', 'ทั้งตัว', 'ผม', 'ก็', 'เช่น', 'กันที่', 'ทำได้', 'แค่', 'ดูแล', 'รถ', 'อยู่', 'บ้าน', 'และ', 'ใช้ชีวิต', 'ไป', 'กับ', 'ครอบครัว', 'ซึ่ง', 'คง', 'เป็น', 'อีก', 'ช่วงเวลา', 'หนึ่ง', 'ที่', 'ผม', 'ได้', 'บันทึก', 'เก็บ', 'ไว้', '#', 'ShellAdvancePower', '#', 'ShellAdvanceCity', '#', 'เลือก', 'ไป', 'ให้', 'สุด', 'ใน', 'แบบ', 'คุณ', '#', 'มอเตอร์ไซค์', 'แบบ', 'ไหน', 'ก็', 'เลือก', 'ใช้', 'เชลล์', 'แอ๊ด', 'ว้า', 'นซ์']",The Gaijin Trips แบกเป้เที่ยวคนเดียว
9,,"EP65 แบกเป้เที่ยว สะปัน
อีกหนึ่งช่องทางการติดตาม Youtube Chanel จ้า",,2021-11-02 17:38:00,EP65แบกเป้เที่ยวสะปันอีกหนึ่งช่องทางการติดตามYoutubeChanelจ้า,"['EP', '65', 'แบก', 'เป้', 'เที่ยว', 'สะ', 'ปัน', 'อีก', 'หนึ่ง', 'ช่อง', 'ทางการ', 'ติดตาม', 'YoutubeChanel', 'จ้า']",The Gaijin Trips แบกเป้เที่ยวคนเดียว
10,,สะปัน หมู่บ้านที่เสียงลำธารและสายฝน คล้ายจะเป็นเสียงเดียวกัน ผมเดินทางเข้ามายังหมู่บ้านแห่งนี้เป็นครั้งที่ 3 คงจะไม่ใช่เรื่องบังเอิญที่เราจะกลับมาสถานที่ใดบ่อยๆ ซึ่งในครั้งนี้… เพิ่มเติม,,2021-11-01 07:00:00,สะปันหมู่บ้านที่เสียงลำธารและสายฝนคล้ายจะเป็นเสียงเดียวกันผมเดินทางเข้ามายังหมู่บ้านแห่งนี้เป็นครั้งที่3คงจะไม่ใช่เรื่องบังเอิญที่เราจะกลับมาสถานที่ใดบ่อยๆซึ่งในครั้งนี้เพิ่มเติม,"['สะ', 'ปัน', 'หมู่บ้าน', 'ที่', 'เสียง', 'ลำธาร', 'และ', 'สายฝน', 'คล้าย', 'จะ', 'เป็น', 'เสียง', 'เดียว', 'กันผม', 'เดิน', 'ทางเข้า', 'มายัง', 'หมู่บ้าน', 'แห่ง', 'นี้', 'เป็น', 'ครั้ง', 'ที่', '3', 'คงจะ', 'ไม่', 'ใช่', 'เรื่อง', 'บังเอิญ', 'ที่', 'เรา', 'จะ', 'กลับมา', 'สถาน', 'ที่ใด', 'บ่อยๆ', 'ซึ่ง', 'ใน', 'ครั้งนี้', 'เพิ่มเติม']",The Gaijin Trips แบกเป้เที่ยวคนเดียว
11,,"ต้นเดือนเจอกัน กับ EP65 สะปัน
อากาศหนาวกับสายฝนเป็นทุกอย่างของนักเดินทาง",,2021-10-30 12:45:00,ต้นเดือนเจอกันกับEP65สะปันอากาศหนาวกับสายฝนเป็นทุกอย่างของนักเดินทาง,"['ต้นเดือน', 'เจอกัน', 'กับ', 'EP', '65', 'สะ', 'ปัน', 'อากาศ', 'หนาว', 'กับ', 'สายฝน', 'เป็น', 'ทุกอย่าง', 'ของ', 'นักเดินทาง']",The Gaijin Trips แบกเป้เที่ยวคนเดียว
12,,กรุงรัตนโกสินทร์ หรือกรุงเทพในปัจจุบันคงเป็นสถานที่ที่มีเรื่องเล่าแตกต่างกันไปในแต่ละช่วงวัยของคน การเดินทางครั้งนี้ของผมนั้น เป็นการได้เรียนรู้ประวัติศาสตร์เรื่องเล่าแต่เดิมจาก ดร.วันชัย… เพิ่มเติม,,2021-10-29 12:22:00,กรุงรัตนโกสินทร์หรือกรุงเทพในปัจจุบันคงเป็นสถานที่ที่มีเรื่องเล่าแตกต่างกันไปในแต่ละช่วงวัยของคนการเดินทางครั้งนี้ของผมนั้นเป็นการได้เรียนรู้ประวัติศาสตร์เรื่องเล่าแต่เดิมจากดร.วันชัยเพิ่มเติม,"['กรุงรัตนโกสินทร์', 'หรือ', 'กรุงเทพ', 'ใน', 'ปัจจุบัน', 'คง', 'เป็น', 'สถานที่', 'ที่', 'มี', 'เรื่องเล่า', 'แตก', 'ต่างกัน', 'ไป', 'ใน', 'แต่ละ', 'ช่วง', 'วัย', 'ของ', 'คน', 'การ', 'เดินทาง', 'ครั้งนี้', 'ของ', 'ผม', 'นั้น', 'เป็นการ', 'ได้', 'เรียนรู้', 'ประวัติศาสตร์', 'เรื่องเล่า', 'แต่เดิม', 'จาก', 'ดร.', 'วัน', 'ชัย', 'เพิ่มเติม']",The Gaijin Trips แบกเป้เที่ยวคนเดียว
13,,"ขอบคุณรางวัล WINNER BEST TRAVEL INFLUENCER จากทาง Thailand Influencer Awards 2021 ที่จัดขึ้นโดย #TellScore ด้วยนะครับ
ไม่คิดว่าจะได้รางวัลชนะเลิศกับเขาในปีนี้ ขอบคุณทุกคนที่สนับสนุนและติดตามกันมานะครับ หวังว่าจะทำให้ทุกคนมีความสุขกับแต่ละเรื่องราวที่เราสื่อสารออกไปนะ 🙏❤️",,2021-10-27 15:45:00,ขอบคุณรางวัลWINNERBESTTRAVELINFLUENCERจากทางThailandInfluencerAwards2021ที่จัดขึ้นโดย#TellScoreด้วยนะครับไม่คิดว่าจะได้รางวัลชนะเลิศกับเขาในปีนี้ขอบคุณทุกคนที่สนับสนุนและติดตามกันมานะครับหวังว่าจะทำให้ทุกคนมีความสุขกับแต่ละเรื่องราวที่เราสื่อสารออกไปนะ,"['ขอบคุณ', 'รางวัล', 'WINNERBESTTRAVELINFLUENCER', 'จาก', 'ทาง', 'ThailandInfluencerAwards', '2021', 'ที่', 'จัด', 'ขึ้น', 'โดย', '#', 'TellScore', 'ด้วย', 'นะ', 'ครับ', 'ไม่', 'คิด', 'ว่า', 'จะ', 'ได้', 'รางวัล', 'ชนะเลิศ', 'กับ', 'เขา', 'ใน', 'ปี', 'นี้', 'ขอบคุณ', 'ทุกคน', 'ที่', 'สนับสนุน', 'และ', 'ติดตาม', 'กัน', 'มานะ', 'ครับ', 'หวัง', 'ว่า', 'จะ', 'ทำให้', 'ทุกคน', 'มีความสุข', 'กับ', 'แต่ละ', 'เรื่องราว', 'ที่', 'เรา', 'สื่อสาร', 'ออก', 'ไป', 'นะ']",The Gaijin Trips แบกเป้เที่ยวคนเดียว
14,,อีกหนึ่งมุมมองจากการเดินทางผ่านสายตาพี่เบียร์สดในทริปอีสานคลาสสิค ดีใจที่ได้ ร่วมเดินทางกับพี่นะครับ 🏍🙂,,2021-10-25 10:05:00,อีกหนึ่งมุมมองจากการเดินทางผ่านสายตาพี่เบียร์สดในทริปอีสานคลาสสิคดีใจที่ได้ร่วมเดินทางกับพี่นะครับ,"['อีก', 'หนึ่ง', 'มุมมอง', 'จาก', 'การ', 'เดินทาง', 'ผ่านสายตา', 'พี่', 'เบียร์สด', 'ใน', 'ทริป', 'อีสาน', 'คลาสสิค', 'ดีใจ', 'ที่', 'ได้', 'ร่วม', 'เดินทาง', 'กับ', 'พี่', 'นะ', 'ครับ']",The Gaijin Trips แบกเป้เที่ยวคนเดียว
15,,"หลายครั้งที่คนถามว่าเราใช้กล้องอะไร บางทีก็ตอบกันไม่หวั่นไม่ไหวเท่าไหร่ และวันนี้เราจะมาเปิดตัวกล้องใหม่ที่ไกจินกำลังจะใช้เลยละกันนะ เพราะกล้องเก่าดันลาโลกไปซะก่อน กับการเดินทางไปยังน้ำตกเขาชะเมาในวันนี้
#SONY #A7IV #Alpha7IV",,2021-10-21 21:48:00,หลายครั้งที่คนถามว่าเราใช้กล้องอะไรบางทีก็ตอบกันไม่หวั่นไม่ไหวเท่าไหร่และวันนี้เราจะมาเปิดตัวกล้องใหม่ที่ไกจินกำลังจะใช้เลยละกันนะเพราะกล้องเก่าดันลาโลกไปซะก่อนกับการเดินทางไปยังน้ำตกเขาชะเมาในวันนี้#SONY#A7IV#Alpha7IV,"['หลายครั้ง', 'ที่', 'คน', 'ถาม', 'ว่า', 'เรา', 'ใช้', 'กล้อง', 'อะไร', 'บางที', 'ก็', 'ตอบ', 'กัน', 'ไม่', 'หวั่น', 'ไม่', 'ไหว', 'เท่าไหร่', 'และ', 'วันนี้', 'เรา', 'จะ', 'มา', 'เปิดตัว', 'กล้อง', 'ใหม่', 'ที่', 'ไก', 'จิน', 'กำลังจะ', 'ใช้', 'เลย', 'ละ', 'กัน', 'นะ', 'เพราะ', 'กล้อง', 'เก่า', 'ดัน', 'ลาโลก', 'ไป', 'ซะ', 'ก่อน', 'กับ', 'การ', 'เดินทาง', 'ไป', 'ยัง', 'น้ำตก', 'เขา', 'ชะ', 'เมา', 'ใน', 'วันนี้', '#', 'SONY', '#', 'A', '7', 'IV', '#', 'Alpha', '7', 'IV']",The Gaijin Trips แบกเป้เที่ยวคนเดียว
16,,ฮ่องเพล้ง กับอ้ายเบนซ์ ในบทเพล้ง Don't let me down จากซาวขณะเดอะบีทเทิ้ล ขอบคุ้นหลายๆที่รับฟังข่อย 😂,,2021-10-20 21:07:00,ฮ่องเพล้งกับอ้ายเบนซ์ในบทเพล้งDon'tletmedownจากซาวขณะเดอะบีทเทิ้ลขอบคุ้นหลายๆที่รับฟังข่อย,"['ฮ่อ', 'ง', 'เพ', 'ล้ง', 'กับ', 'อ้าย', 'เบนซ์', 'ใน', 'บท', 'เพ', 'ล้ง', 'Don', ""'"", 'tletmedown', 'จาก', 'ซาว', 'ขณะ', 'เดอะ', 'บีท', 'เทิ้ล', 'ขอบ', 'คุ้น', 'หลาย', 'ๆ', 'ที่', 'รับฟัง', 'ข่อย']",The Gaijin Trips แบกเป้เที่ยวคนเดียว
17,,อีสานคลาสสิคทริป Ep.3 (ตอนจบ) บทสุดท้ายก็มาถึง ไม่ว่าเริ่มจากไหน หรือจบที่ใด หนทางพิสูจน์ม้า กาลเวลาพิสูจน์คน ทุกการเดินทางมีความสำคัญ… เพิ่มเติม,,2021-10-18 07:32:00,อีสานคลาสสิคทริปEp.3(ตอนจบ)บทสุดท้ายก็มาถึงไม่ว่าเริ่มจากไหนหรือจบที่ใดหนทางพิสูจน์ม้ากาลเวลาพิสูจน์คนทุกการเดินทางมีความสำคัญเพิ่มเติม,"['อีสาน', 'คลาสสิค', 'ทริป', 'Ep', '.', '3', '(', 'ตอนจบ', ')บท', 'สุดท้าย', 'ก็', 'มาถึง', 'ไม่', 'ว่า', 'เริ่ม', 'จาก', 'ไหน', 'หรือ', 'จบ', 'ที่ใด', 'หนทาง', 'พิสูจน์', 'ม้า', 'กาลเวลา', 'พิสูจน์', 'คน', 'ทุก', 'การ', 'เดินทาง', 'มีความสำคัญ', 'เพิ่มเติม']",The Gaijin Trips แบกเป้เที่ยวคนเดียว
18,,"เป็นอีกหนึ่งการเดินทางที่เบนซ์ตั้งใจสื่อสารโคราชออกมาในมุมมองที่แตกต่าง ดีใจที่หลายคนมีความสุขเมื่อได้ดูงานชิ้นนี้นะครับ
อีกหนึ่งช่องทางในการติดตาม Youtube Chanel Gaijin",,2021-10-17 11:48:00,เป็นอีกหนึ่งการเดินทางที่เบนซ์ตั้งใจสื่อสารโคราชออกมาในมุมมองที่แตกต่างดีใจที่หลายคนมีความสุขเมื่อได้ดูงานชิ้นนี้นะครับอีกหนึ่งช่องทางในการติดตามYoutubeChanelGaijin,"['เป็น', 'อีก', 'หนึ่ง', 'การ', 'เดินทาง', 'ที่', 'เบนซ์', 'ตั้งใจ', 'สื่อสาร', 'โคราช', 'ออกมา', 'ใน', 'มุมมอง', 'ที่', 'แตกต่าง', 'ดีใจ', 'ที่', 'หลาย', 'คน', 'มีความสุข', 'เมื่อ', 'ได้', 'ดูงาน', 'ชิ้น', 'นี้', 'นะ', 'ครับ', 'อีก', 'หนึ่ง', 'ช่อง', 'ทางใน', 'การ', 'ติดตาม', 'YoutubeChanelGaijin']",The Gaijin Trips แบกเป้เที่ยวคนเดียว
