,Place,Post,Share,Date,CPost,WPost,Page
288,,"The Gaijin Trips แบกเป้เที่ยวคนเดียว EP27 แบกเป้เที่ยวลำปาง 3 วัน 2 คืน
ลำปาง จังหวัดที่มีเสน่ห์ซ่อนอยู่แต่ละที่ในมุมของความเงียบสงบ และน้ำใจของผู้คนที่ดำเนินชีวิตอย่างเรียบง่าย การเดินทางด้วยรถไฟครั้งนี้ของผม… เพิ่มเติม",,2019-10-01 08:30:00,TheGaijinTripsแบกเป้เที่ยวคนเดียวEP27แบกเป้เที่ยวลำปาง3วัน2คืนลำปางจังหวัดที่มีเสน่ห์ซ่อนอยู่แต่ละที่ในมุมของความเงียบสงบและน้ำใจของผู้คนที่ดำเนินชีวิตอย่างเรียบง่ายการเดินทางด้วยรถไฟครั้งนี้ของผมเพิ่มเติม,"['TheGaijinTrips', 'แบก', 'เป้', 'เที่ยว', 'คนเดียว', 'EP', '27', 'แบก', 'เป้', 'เที่ยว', 'ลำปาง', '3', 'วัน', '2', 'คืน', 'ลำปาง', 'จังหวัด', 'ที่', 'มีเสน่ห์', 'ซ่อน', 'อยู่', 'แต่ละ', 'ที่', 'ใน', 'มุม', 'ของ', 'ความเงียบสงบ', 'และ', 'น้ำใจ', 'ของ', 'ผู้คน', 'ที่', 'ดำเนินชีวิต', 'อย่าง', 'เรียบง่าย', 'การ', 'เดินทาง', 'ด้วย', 'รถไฟ', 'ครั้งนี้', 'ของ', 'ผม', 'เพิ่มเติม']",The Gaijin Trips แบกเป้เที่ยวคนเดียว
289,,"EP27 ลำปาง หนาวมั้ย?
พร้อมกันต้นเดือนนะครับ 😄✋",,2019-09-27 16:45:00,EP27ลำปางหนาวมั้ย?พร้อมกันต้นเดือนนะครับ,"['EP', '27', 'ลำปาง', 'หนาว', 'มั้ย', '?', 'พร้อมกัน', 'ต้นเดือน', 'นะ', 'ครับ']",The Gaijin Trips แบกเป้เที่ยวคนเดียว
290,,"เคยได้ยินหลายคนพูดถึงคำถามนี้กันบ่อยครั้ง ผมก็ชอบเที่ยวต่างประเทศนะ แต่ก็ไม่เห็นเลยว่าประเทศไทยควรจะราคาถูกกว่าบ้านเขา 🙂
ภูมิใจที่ได้เที่ยวไทยนะ 🇹🇭",,2019-09-26 11:48:00,เคยได้ยินหลายคนพูดถึงคำถามนี้กันบ่อยครั้งผมก็ชอบเที่ยวต่างประเทศนะแต่ก็ไม่เห็นเลยว่าประเทศไทยควรจะราคาถูกกว่าบ้านเขาภูมิใจที่ได้เที่ยวไทยนะ,"['เคย', 'ได้ยิน', 'หลาย', 'คน', 'พูดถึง', 'คำถาม', 'นี้', 'กัน', 'บ่อยครั้ง', 'ผม', 'ก็', 'ชอบ', 'เที่ยว', 'ต่างประเทศ', 'นะ', 'แต่', 'ก็', 'ไม่', 'เห็น', 'เลย', 'ว่า', 'ประเทศ', 'ไทย', 'ควรจะ', 'ราคา', 'ถูก', 'กว่า', 'บ้าน', 'เขา', 'ภูมิใจ', 'ที่', 'ได้', 'เที่ยว', 'ไทย', 'นะ']",The Gaijin Trips แบกเป้เที่ยวคนเดียว
291,,📍ขออนุญาติ ปิดการพาเพื่อนร่วมทางไปภูกระดึง ภายใน 12 ชั่วโมงที่เปิดให้พี่ๆเพื่อนๆส่งคลิปกันเข้ามานะครับ เนื่องจากเกรงว่าถ้ามีหลายคนส่งคลิปเข้ามา ถ้าเปิดให้ส่งในระยะเวลาถึง1อาทิตย์… เพิ่มเติม,,2019-09-23 05:40:00,ขออนุญาติปิดการพาเพื่อนร่วมทางไปภูกระดึงภายใน12ชั่วโมงที่เปิดให้พี่ๆเพื่อนๆส่งคลิปกันเข้ามานะครับเนื่องจากเกรงว่าถ้ามีหลายคนส่งคลิปเข้ามาถ้าเปิดให้ส่งในระยะเวลาถึง1อาทิตย์เพิ่มเติม,"['ขอ', 'อนุ', 'ญาติ', 'ปิด', 'การพา', 'เพื่อนร่วมทาง', 'ไป', 'ภู', 'กระดึง', 'ภายใน', '12', 'ชั่วโมง', 'ที่', 'เปิด', 'ให้', 'พี่', 'ๆ', 'เพื่อน', 'ๆ', 'ส่ง', 'คลิป', 'กัน', 'เข้า', 'มานะ', 'ครับ', 'เนื่องจาก', 'เกรง', 'ว่า', 'ถ้า', 'มี', 'หลาย', 'คน', 'ส่ง', 'คลิป', 'เข้ามา', 'ถ้า', 'เปิด', 'ให้', 'ส่ง', 'ใน', 'ระยะเวลา', 'ถึง', '1', 'อาทิตย์', 'เพิ่มเติม']",The Gaijin Trips แบกเป้เที่ยวคนเดียว
292,,"📍📍ปิดการหาเพื่อนร่วมทางแล้วครับ
📍เชิญชวนร่วมเดินทาง เที่ยวภูกระดึง กับไกจิน
📍คุณสมบัติของผู้สมัครคัดเลือก
-อายุ 20 ปี ขึ้นไป
-สุขภาพแข็งแรง
📍กติกาในการคัดเลือกผู้เข้าร่วมเดินทาง (จำนวนจำกัด)… เพิ่มเติม",,2019-09-22 16:48:00,ปิดการหาเพื่อนร่วมทางแล้วครับเชิญชวนร่วมเดินทางเที่ยวภูกระดึงกับไกจินคุณสมบัติของผู้สมัครคัดเลือก-อายุ20ปีขึ้นไป-สุขภาพแข็งแรงกติกาในการคัดเลือกผู้เข้าร่วมเดินทาง(จำนวนจำกัด)เพิ่มเติม,"['ปิด', 'การ', 'หา', 'เพื่อนร่วมทาง', 'แล้ว', 'ครับ', 'เชิญชวน', 'ร่วม', 'เดินทาง', 'เที่ยว', 'ภู', 'กระดึง', 'กับ', 'ไก', 'จิน', 'คุณสมบัติ', 'ของ', 'ผู้สมัคร', 'คัดเลือก', '-', 'อายุ', '20', 'ปี', 'ขึ้นไป', '-', 'สุขภาพ', 'แข็งแรง', 'กติกา', 'ใน', 'การคัดเลือก', 'ผู้เข้าร่วม', 'เดินทาง', '(', 'จำนวน', 'จำกัด', ')', 'เพิ่มเติม']",The Gaijin Trips แบกเป้เที่ยวคนเดียว
293,,"Hilight The Gaijin Trips กับมุมมองที่มีต่ออุทยานแห่งชาติ
การประชุมการบริหารจัดการอุทยานแห่งชาติประเทศไทยสู่สากล ในวันที่ 18 กันยายน 2562
… เพิ่มเติม",,2019-09-20 17:52:00,HilightTheGaijinTripsกับมุมมองที่มีต่ออุทยานแห่งชาติการประชุมการบริหารจัดการอุทยานแห่งชาติประเทศไทยสู่สากลในวันที่18กันยายน2562เพิ่มเติม,"['HilightTheGaijinTrips', 'กับ', 'มุมมอง', 'ที่', 'มี', 'ต่อ', 'อุทยานแห่งชาติ', 'การประชุม', 'การบริหาร', 'จัดการ', 'อุทยานแห่งชาติ', 'ประเทศ', 'ไทย', 'สู่', 'สากล', 'ใน', 'วันที่', '18', 'กันยายน', '2562', 'เพิ่มเติม']",The Gaijin Trips แบกเป้เที่ยวคนเดียว
294,,ขึ้นชื่อว่าจังหวัดแม่ฮ่องสอน เป็นจังหวัดใหญ่และเต็มไปด้วยสถานที่ท่องเที่ยวมากมายจังหวัดหนึ่ง ที่ถ้าคุณได้ไปเที่ยวสักครั้งนั้น จะไม่ผิดหวังเลยทีเดียว,,2019-09-19 11:12:00,ขึ้นชื่อว่าจังหวัดแม่ฮ่องสอนเป็นจังหวัดใหญ่และเต็มไปด้วยสถานที่ท่องเที่ยวมากมายจังหวัดหนึ่งที่ถ้าคุณได้ไปเที่ยวสักครั้งนั้นจะไม่ผิดหวังเลยทีเดียว,"['ขึ้นชื่อว่า', 'จังหวัด', 'แม่ฮ่องสอน', 'เป็น', 'จังหวัด', 'ใหญ่', 'และ', 'เต็มไปด้วย', 'สถานที่ท่องเที่ยว', 'มากมาย', 'จังหวัด', 'หนึ่ง', 'ที่', 'ถ้า', 'คุณ', 'ได้', 'ไปเที่ยว', 'สัก', 'ครั้งนั้น', 'จะ', 'ไม่', 'ผิดหวัง', 'เลย', 'ทีเดียว']",The Gaijin Trips แบกเป้เที่ยวคนเดียว
296,,อาาา สิ เพ้น ยาาาา,,2019-09-17 19:55:00,อาาาสิเพ้นยาาาา,"['อา', 'าา', 'สิ', 'เพ้น', 'ยา', 'าาา']",The Gaijin Trips แบกเป้เที่ยวคนเดียว
297,,"ดู EP26 แม่ฮ่องสอน แล้วเป็นยังไงกันบ้างครับ😊
อีกหนึ่งช่องทางในการติดตามจาก Youtube",,2019-09-16 10:30:00,ดูEP26แม่ฮ่องสอนแล้วเป็นยังไงกันบ้างครับอีกหนึ่งช่องทางในการติดตามจากYoutube,"['ดู', 'EP', '26', 'แม่ฮ่องสอน', 'แล้ว', 'เป็น', 'ยังไง', 'กัน', 'บ้าง', 'ครับ', 'อีก', 'หนึ่ง', 'ช่อง', 'ทางใน', 'การ', 'ติดตาม', 'จาก', 'Youtube']",The Gaijin Trips แบกเป้เที่ยวคนเดียว
298,,"The Gaijin Trips แบกเป้เที่ยวคนเดียว EP26 แบกเป้เที่ยวแม่ฮ่องสอน 4 วัน 3คืน
จังหวัดแม่ฮ่องสอน คงเป็นสถานที่หนึ่งที่เป็นที่ตั้งของธรรมชาติที่สวยงามและผู้คนหลากหลายชนเผ่า… เพิ่มเติม",,2019-09-15 07:52:00,TheGaijinTripsแบกเป้เที่ยวคนเดียวEP26แบกเป้เที่ยวแม่ฮ่องสอน4วัน3คืนจังหวัดแม่ฮ่องสอนคงเป็นสถานที่หนึ่งที่เป็นที่ตั้งของธรรมชาติที่สวยงามและผู้คนหลากหลายชนเผ่าเพิ่มเติม,"['TheGaijinTrips', 'แบก', 'เป้', 'เที่ยว', 'คนเดียว', 'EP', '26', 'แบก', 'เป้', 'เที่ยว', 'แม่ฮ่องสอน', '4', 'วัน', '3', 'คืน', 'จังหวัด', 'แม่ฮ่องสอน', 'คง', 'เป็น', 'สถาน', 'ที่หนึ่ง', 'ที่', 'เป็นที่ตั้ง', 'ของ', 'ธรรมชาติ', 'ที่', 'สวยงาม', 'และ', 'ผู้คน', 'หลากหลาย', 'ชน', 'เผ่า', 'เพิ่มเติม']",The Gaijin Trips แบกเป้เที่ยวคนเดียว
299,,"ฝนนี้ แม่ฮ่องสอนดีมั้ย :)
ติดตาม EP26 แม่ฮ่องสอน ได้พร้อมกันกลางเดือนนี้ครับ
#อีพีนี้ดูกันยาวๆเลยจ้า",,2019-09-10 11:00:00,ฝนนี้แม่ฮ่องสอนดีมั้ย:)ติดตามEP26แม่ฮ่องสอนได้พร้อมกันกลางเดือนนี้ครับ#อีพีนี้ดูกันยาวๆเลยจ้า,"['ฝน', 'นี้', 'แม่ฮ่องสอน', 'ดี', 'มั้ย', ':)', 'ติดตาม', 'EP', '26', 'แม่ฮ่องสอน', 'ได้', 'พร้อมกัน', 'กลางเดือน', 'นี้', 'ครับ', '#', 'อี', 'พี', 'นี้', 'ดู', 'กัน', 'ยาว', 'ๆ', 'เลย', 'จ้า']",The Gaijin Trips แบกเป้เที่ยวคนเดียว
300,,ถ้าพูดถึงเชียงคาน สิ่งแรกที่ทุกคนพอจะนึกภาพตามก็คงเป็นบ้านไม้โบราญและตลาดคนเดินเก๋ๆที่เป็นที่รู้จักกันในจังหวัดเลย แต่ครั้งนี้เราจะพามาท่องเที่ยวทั้งถนนคนเดิน และสถานที่ท่องเที่ยวใกล้เคียง ให้การเดินทางมาเชียงคานครั้งนี้ คุ้มค่าและได้หลากหลายรสชาติยิ่งขึ้น,,2019-09-03 11:57:00,ถ้าพูดถึงเชียงคานสิ่งแรกที่ทุกคนพอจะนึกภาพตามก็คงเป็นบ้านไม้โบราญและตลาดคนเดินเก๋ๆที่เป็นที่รู้จักกันในจังหวัดเลยแต่ครั้งนี้เราจะพามาท่องเที่ยวทั้งถนนคนเดินและสถานที่ท่องเที่ยวใกล้เคียงให้การเดินทางมาเชียงคานครั้งนี้คุ้มค่าและได้หลากหลายรสชาติยิ่งขึ้น,"['ถ้า', 'พูดถึง', 'เชียงคาน', 'สิ่ง', 'แรก', 'ที่', 'ทุกคน', 'พอ', 'จะ', 'นึก', 'ภาพ', 'ตาม', 'ก็', 'คง', 'เป็น', 'บ้าน', 'ไม้', 'โบ', 'ราญ', 'และ', 'ตลาด', 'คน', 'เดิน', 'เก๋', 'ๆ', 'ที่', 'เป็นที่รู้จัก', 'กัน', 'ใน', 'จังหวัด', 'เลย', 'แต่', 'ครั้งนี้', 'เรา', 'จะ', 'พา', 'มา', 'ท่องเที่ยว', 'ทั้ง', 'ถนน', 'คน', 'เดิน', 'และ', 'สถานที่ท่องเที่ยว', 'ใกล้เคียง', 'ให้การ', 'เดินทาง', 'มา', 'เชียงคาน', 'ครั้งนี้', 'คุ้มค่า', 'และ', 'ได้', 'หลากหลาย', 'รสชาติ', 'ยิ่งขึ้น']",The Gaijin Trips แบกเป้เที่ยวคนเดียว
301,,"อีกหนึ่งช่องทางทาง Youtube ให้ติดตามกับ
EP25 เชียงคาน
#ขอบคุณที่ติดตามครับ",,2019-09-02 10:50:00,อีกหนึ่งช่องทางทางYoutubeให้ติดตามกับEP25เชียงคาน#ขอบคุณที่ติดตามครับ,"['อีก', 'หนึ่ง', 'ช่องทาง', 'ทาง', 'Youtube', 'ให้', 'ติดตาม', 'กับ', 'EP', '25', 'เชียงคาน', '#', 'ขอบคุณ', 'ที่', 'ติดตาม', 'ครับ']",The Gaijin Trips แบกเป้เที่ยวคนเดียว
302,,"The Gaijin Trips แบกเป้เที่ยวคนเดียว EP25 แบกเป้เที่ยวเชียงคาน 2 วัน 1 คืน ด้วยงบ 2,500 บาท
เชียงคาน เมืองที่หลายคนหลงไหลในศิลปวัฒนธรรมของสถานที่แห่งนี้… เพิ่มเติม",,2019-09-01 08:59:00,"TheGaijinTripsแบกเป้เที่ยวคนเดียวEP25แบกเป้เที่ยวเชียงคาน2วัน1คืนด้วยงบ2,500บาทเชียงคานเมืองที่หลายคนหลงไหลในศิลปวัฒนธรรมของสถานที่แห่งนี้เพิ่มเติม","['TheGaijinTrips', 'แบก', 'เป้', 'เที่ยว', 'คนเดียว', 'EP', '25', 'แบก', 'เป้', 'เที่ยว', 'เชียงคาน', '2', 'วัน', '1', 'คืน', 'ด้วย', 'งบ', '2,500', 'บาท', 'เชียงคาน', 'เมือง', 'ที่', 'หลาย', 'คน', 'หลง', 'ไหล', 'ใน', 'ศิลปวัฒนธรรม', 'ของ', 'สถานที่', 'แห่ง', 'นี้', 'เพิ่มเติม']",The Gaijin Trips แบกเป้เที่ยวคนเดียว
303,,"EP25 เชียงคาน
พักเบรคท่องเที่ยวแบบสบายๆพร้อมกันต้นเดือนครับ🙏😄",,2019-08-27 17:46:00,EP25เชียงคานพักเบรคท่องเที่ยวแบบสบายๆพร้อมกันต้นเดือนครับ,"['EP', '25', 'เชียงคาน', 'พัก', 'เบรค', 'ท่องเที่ยว', 'แบบ', 'สบาย', 'ๆ', 'พร้อมกัน', 'ต้นเดือน', 'ครับ']",The Gaijin Trips แบกเป้เที่ยวคนเดียว
304,,"SOLD OUT 📍ขายหมดแล้ว กรุณาอ่าน!!!!!!!!
ขอบคุณทุกๆคนที่สนับสนุนเรามากๆนะครับ เราทำเสื้อมาจำนวนพอสมควรโดยคิดว่าเป็นจำนวนที่มากพอสำหรับความคิดเราแล้ว และไม่คิดว่าจะมีคนสนับสนุนมากถึงเพียงนี้… เพิ่มเติม",,2019-08-26 07:32:00,SOLDOUTขายหมดแล้วกรุณาอ่าน!!!!!!!!ขอบคุณทุกๆคนที่สนับสนุนเรามากๆนะครับเราทำเสื้อมาจำนวนพอสมควรโดยคิดว่าเป็นจำนวนที่มากพอสำหรับความคิดเราแล้วและไม่คิดว่าจะมีคนสนับสนุนมากถึงเพียงนี้เพิ่มเติม,"['SOLDOUT', 'ขาย', 'หมด', 'แล้ว', 'กรุณา', 'อ่าน', '!!!!!!!!', 'ขอบคุณ', 'ทุกๆ', 'คน', 'ที่', 'สนับสนุน', 'เรา', 'มาก', 'ๆ', 'นะ', 'ครับ', 'เรา', 'ทำ', 'เสื้อ', 'มา', 'จำนวน', 'พอสมควร', 'โดย', 'คิด', 'ว่า', 'เป็น', 'จำนวน', 'ที่', 'มาก', 'พอ', 'สำหรับ', 'ความคิด', 'เรา', 'แล้ว', 'และ', 'ไม่', 'คิด', 'ว่า', 'จะ', 'มี', 'คน', 'สนับสนุน', 'มาก', 'ถึง', 'เพียงนี้', 'เพิ่มเติม']",The Gaijin Trips แบกเป้เที่ยวคนเดียว
305,,"SOLD OUT! 📍ขายหมดแล้ว กรุณาอ่าน!!!!!!!!!!!
เสื้อครบรอบ1ปี The Gaijin Trips กับเสื้อยืดคอกลม กระเป๋าหน้า เปิดให้จองตังแต่วันนี้ ถึง 31 สิงหาคม พ.ศ. 2562
ราคา 450 บาท แถมฟรีสติ๊กเกอร์ 2 แบบ (ส่งฟรีลงทะเบียน)
… เพิ่มเติม",,2019-08-23 15:44:00,SOLDOUT!ขายหมดแล้วกรุณาอ่าน!!!!!!!!!!!เสื้อครบรอบ1ปีTheGaijinTripsกับเสื้อยืดคอกลมกระเป๋าหน้าเปิดให้จองตังแต่วันนี้ถึง31สิงหาคมพ.ศ.2562ราคา450บาทแถมฟรีสติ๊กเกอร์2แบบ(ส่งฟรีลงทะเบียน)เพิ่มเติม,"['SOLDOUT', '!', 'ขาย', 'หมด', 'แล้ว', 'กรุณา', 'อ่าน', '!!!!!!!!!!!', 'เสื้อ', 'ครบรอบ', '1', 'ปี', 'TheGaijinTrips', 'กับ', 'เสื้อยืด', 'คอกลม', 'กระเป๋า', 'หน้าเปิด', 'ให้', 'จอง', 'ตัง', 'แต่', 'วันนี้', 'ถึง', '31', 'สิงหาคม', 'พ.ศ.', '2562', 'ราคา', '450', 'บาท', 'แถม', 'ฟรี', 'สติ๊กเกอร์', '2', 'แบบ', '(', 'ส่ง', 'ฟรี', 'ลงทะเบียน', ')', 'เพิ่มเติม']",The Gaijin Trips แบกเป้เที่ยวคนเดียว
306,,"ขึ้นชื่อว่าภูทับเบิก สายเที่ยวคงจะไม่มีใครที่ไม่รู้จักสถานที่แห่งนี้ และเชื่อว่าหลายคนคงเคยได้ไปสัมผัสภูทับเบิกในมุมมองของแต่ละคนที่แตกต่างกันออกไป ครั้งนี้ The Gaijin Trips จะพาทุกคนโบกรถขึ้นไปพร้อมกันที่ภูทับเบิก
ชมวีดีโอเต็มๆได้ที่ : https://www.youtube.com/watch?v=RT_uVV1sTRM&t=2s",,2019-08-18 11:35:00,ขึ้นชื่อว่าภูทับเบิกสายเที่ยวคงจะไม่มีใครที่ไม่รู้จักสถานที่แห่งนี้และเชื่อว่าหลายคนคงเคยได้ไปสัมผัสภูทับเบิกในมุมมองของแต่ละคนที่แตกต่างกันออกไปครั้งนี้TheGaijinTripsจะพาทุกคนโบกรถขึ้นไปพร้อมกันที่ภูทับเบิกชมวีดีโอเต็มๆได้ที่:https://www.youtube.com/watch?v=RT_uVV1sTRM&t=2s,"['ขึ้นชื่อว่า', 'ภู', 'ทับ', 'เบิก', 'สาย', 'เที่ยว', 'คงจะ', 'ไม่', 'มี', 'ใคร', 'ที่', 'ไม่', 'รู้จัก', 'สถานที่', 'แห่ง', 'นี้', 'และ', 'เชื่อ', 'ว่า', 'หลาย', 'คน', 'คง', 'เคย', 'ได้', 'ไป', 'สัมผัส', 'ภู', 'ทับ', 'เบิก', 'ใน', 'มุมมอง', 'ของ', 'แต่ละคน', 'ที่', 'แตก', 'ต่างกัน', 'ออก', 'ไป', 'ครั้งนี้', 'TheGaijinTrips', 'จะ', 'พา', 'ทุกคน', 'โบก', 'รถ', 'ขึ้นไป', 'พร้อม', 'กันที่', 'ภู', 'ทับ', 'เบิก', 'ชม', 'วีดีโอ', 'เต็มๆ', 'ได้ที่', ':', 'https', '://', 'www', '.', 'youtube', '.', 'com', '/', 'watch', '?', 'v', '=', 'RT', '_', 'uVV', '1', 'sTRM', '&', 't', '=', '2', 's']",The Gaijin Trips แบกเป้เที่ยวคนเดียว
